My Computer
USB xHCI Compliant Host Controller


DriverKey: {36fc9e60-c465-11cf-8056-444553540000}\0000
VendorID: 8086
DeviceID: A2AF
SubSysID: 07A21028
Revision: 00

Debug Port Number:  0
Bus.Device.Function (in decimal): 0.20.0

Host Controller Power State Mappings
System State		Host Controller		Root Hub	USB wakeup	Powered
S0 (working)    	D0              	S? (unmapped)   		
S1 (sleep)      	D? (unspecified)	D3              		
S2 (sleep)      	D? (unspecified)	D3              		
S3 (sleep)      	D3              	D2              Yes		Yes
S4 (Hibernate)  	D3              	D2              Yes		Yes
Last Sleep State	S3 (sleep)      
RootHub


Root Hub: USB#ROOT_HUB30#4&3b5bb164&0&0#{f18a0e88-c30c-11d0-8815-00a0c906bed8}
Hub Power:                    Self Power
Number of Ports:              26
Power switching:              Ganged
Compound device:              No
Over-current Protection:      Global
High speed capable:           No
High speed:                   Yes
Multiple transaction translations capable:                 No
Performs multiple transaction translations simultaneously: No
Hub wakes when device is connected:                        No
Hub is bus powered:           No
Hub is root:                  Yes
[Port1]  :  USB Composite Device


Is Port User Connectable:         yes
Is Port Debug Capable:            no
Companion Port Number:            17
Companion Hub Symbolic Link Name: USB#ROOT_HUB30#4&3b5bb164&0&0#{f18a0e88-c30c-11d0-8815-00a0c906bed8}
Protocols Supported:
 USB 1.1:                         yes
 USB 2.0:                         yes
 USB 3.0:                         no

Device Power State:               PowerDeviceD0

       ---===>Device Information<===---
English product name: "Dell KB216 Wired Keyboard"

ConnectionStatus:                  
Current Config Value:              0x01  -> Device Bus Speed: Low
Device Address:                    0x01
Open Pipes:                           2

          ===>Device Descriptor<===
bLength:                           0x12
bDescriptorType:                   0x01
bcdUSB:                          0x0110
bDeviceClass:                      0x00  -> This is an Interface Class Defined Device
bDeviceSubClass:                   0x00
bDeviceProtocol:                   0x00
bMaxPacketSize0:                   0x08 = (8) Bytes
idVendor:                        0x413C = Dell Inc.
idProduct:                       0x2113
bcdDevice:                       0x0108
iManufacturer:                     0x00
iProduct:                          0x02
     English (United States)  "Dell KB216 Wired Keyboard"
iSerialNumber:                     0x00
bNumConfigurations:                0x01

          ---===>Open Pipes<===---

          ===>Endpoint Descriptor<===
bLength:                           0x07
bDescriptorType:                   0x05
bEndpointAddress:                  0x81  -> Direction: IN - EndpointID: 1
bmAttributes:                      0x03  -> Interrupt Transfer Type
wMaxPacketSize:                  0x0008
bInterval:                         0x18

          ===>Endpoint Descriptor<===
bLength:                           0x07
bDescriptorType:                   0x05
bEndpointAddress:                  0x82  -> Direction: IN - EndpointID: 2
bmAttributes:                      0x03  -> Interrupt Transfer Type
wMaxPacketSize:                  0x0008
bInterval:                         0x30

       ---===>Full Configuration Descriptor<===---

          ===>Configuration Descriptor<===
bLength:                           0x09
bDescriptorType:                   0x02
wTotalLength:                    0x003B  -> Validated
bNumInterfaces:                    0x02
bConfigurationValue:               0x01
iConfiguration:                    0x00
bmAttributes:                      0xA0  -> Bus Powered
  -> Remote Wakeup
MaxPower:                          0x32 = 100 mA

          ===>Interface Descriptor<===
bLength:                           0x09
bDescriptorType:                   0x04
bInterfaceNumber:                  0x00
bAlternateSetting:                 0x00
bNumEndpoints:                     0x01
bInterfaceClass:                   0x03  -> HID Interface Class
bInterfaceSubClass:                0x01
bInterfaceProtocol:                0x01
iInterface:                        0x00

          ===>HID Descriptor<===
bLength:                           0x09
bDescriptorType:                   0x21
bcdHID:                          0x0111
bCountryCode:                      0x00
bNumDescriptors:                   0x01
bDescriptorType:                   0x22 (Report Descriptor)
wDescriptorLength:               0x0041

          ===>Endpoint Descriptor<===
bLength:                           0x07
bDescriptorType:                   0x05
bEndpointAddress:                  0x81  -> Direction: IN - EndpointID: 1
bmAttributes:                      0x03  -> Interrupt Transfer Type
wMaxPacketSize:                  0x0008
bInterval:                         0x18

          ===>Interface Descriptor<===
bLength:                           0x09
bDescriptorType:                   0x04
bInterfaceNumber:                  0x01
bAlternateSetting:                 0x00
bNumEndpoints:                     0x01
bInterfaceClass:                   0x03  -> HID Interface Class
bInterfaceSubClass:                0x00
bInterfaceProtocol:                0x00
iInterface:                        0x00

          ===>HID Descriptor<===
bLength:                           0x09
bDescriptorType:                   0x21
bcdHID:                          0x0111
bCountryCode:                      0x00
bNumDescriptors:                   0x01
bDescriptorType:                   0x22 (Report Descriptor)
wDescriptorLength:               0x006D

          ===>Endpoint Descriptor<===
bLength:                           0x07
bDescriptorType:                   0x05
bEndpointAddress:                  0x82  -> Direction: IN - EndpointID: 2
bmAttributes:                      0x03  -> Interrupt Transfer Type
wMaxPacketSize:                  0x0008
bInterval:                         0x30
[Port2] 


Is Port User Connectable:         yes
Is Port Debug Capable:            no
Companion Port Number:            18
Companion Hub Symbolic Link Name: USB#ROOT_HUB30#4&3b5bb164&0&0#{f18a0e88-c30c-11d0-8815-00a0c906bed8}
Protocols Supported:
 USB 1.1:                         yes
 USB 2.0:                         yes
 USB 3.0:                         no

ConnectionStatus:      NoDeviceConnected
[Port3] 


Is Port User Connectable:         yes
Is Port Debug Capable:            no
Companion Port Number:            22
Companion Hub Symbolic Link Name: USB#ROOT_HUB30#4&3b5bb164&0&0#{f18a0e88-c30c-11d0-8815-00a0c906bed8}
Protocols Supported:
 USB 1.1:                         yes
 USB 2.0:                         yes
 USB 3.0:                         no

ConnectionStatus:      NoDeviceConnected
[Port4] 


Is Port User Connectable:         yes
Is Port Debug Capable:            no
Companion Port Number:            19
Companion Hub Symbolic Link Name: USB#ROOT_HUB30#4&3b5bb164&0&0#{f18a0e88-c30c-11d0-8815-00a0c906bed8}
Protocols Supported:
 USB 1.1:                         yes
 USB 2.0:                         yes
 USB 3.0:                         no

ConnectionStatus:      NoDeviceConnected
[Port5] 


Is Port User Connectable:         yes
Is Port Debug Capable:            no
Companion Port Number:            20
Companion Hub Symbolic Link Name: USB#ROOT_HUB30#4&3b5bb164&0&0#{f18a0e88-c30c-11d0-8815-00a0c906bed8}
Protocols Supported:
 USB 1.1:                         yes
 USB 2.0:                         yes
 USB 3.0:                         no

ConnectionStatus:      NoDeviceConnected
[Port6] 


Is Port User Connectable:         yes
Is Port Debug Capable:            no
Companion Port Number:            0
Companion Hub Symbolic Link Name: 
Protocols Supported:
 USB 1.1:                         yes
 USB 2.0:                         yes
 USB 3.0:                         no

ConnectionStatus:      NoDeviceConnected
[Port7] 


Is Port User Connectable:         yes
Is Port Debug Capable:            no
Companion Port Number:            21
Companion Hub Symbolic Link Name: USB#ROOT_HUB30#4&3b5bb164&0&0#{f18a0e88-c30c-11d0-8815-00a0c906bed8}
Protocols Supported:
 USB 1.1:                         yes
 USB 2.0:                         yes
 USB 3.0:                         no

ConnectionStatus:      NoDeviceConnected
[Port8] 


Is Port User Connectable:         yes
Is Port Debug Capable:            no
Companion Port Number:            0
Companion Hub Symbolic Link Name: 
Protocols Supported:
 USB 1.1:                         yes
 USB 2.0:                         yes
 USB 3.0:                         no

ConnectionStatus:      NoDeviceConnected
[Port9]  :  USB Input Device


Is Port User Connectable:         yes
Is Port Debug Capable:            no
Companion Port Number:            0
Companion Hub Symbolic Link Name: 
Protocols Supported:
 USB 1.1:                         yes
 USB 2.0:                         yes
 USB 3.0:                         no

Device Power State:               PowerDeviceD0

       ---===>Device Information<===---
English product name: "USB Optical Mouse"

ConnectionStatus:                  
Current Config Value:              0x01  -> Device Bus Speed: Low
Device Address:                    0x03
Open Pipes:                           1

          ===>Device Descriptor<===
bLength:                           0x12
bDescriptorType:                   0x01
bcdUSB:                          0x0200
bDeviceClass:                      0x00  -> This is an Interface Class Defined Device
bDeviceSubClass:                   0x00
bDeviceProtocol:                   0x00
bMaxPacketSize0:                   0x08 = (8) Bytes
idVendor:                        0x046D = Logitech Inc.
idProduct:                       0xC077
bcdDevice:                       0x7200
iManufacturer:                     0x01
     English (United States)  "Logitech"
iProduct:                          0x02
     English (United States)  "USB Optical Mouse"
iSerialNumber:                     0x00
bNumConfigurations:                0x01

          ---===>Open Pipes<===---

          ===>Endpoint Descriptor<===
bLength:                           0x07
bDescriptorType:                   0x05
bEndpointAddress:                  0x81  -> Direction: IN - EndpointID: 1
bmAttributes:                      0x03  -> Interrupt Transfer Type
wMaxPacketSize:                  0x0004
bInterval:                         0x0A

       ---===>Full Configuration Descriptor<===---

          ===>Configuration Descriptor<===
bLength:                           0x09
bDescriptorType:                   0x02
wTotalLength:                    0x0022  -> Validated
bNumInterfaces:                    0x01
bConfigurationValue:               0x01
iConfiguration:                    0x00
bmAttributes:                      0xA0  -> Bus Powered
  -> Remote Wakeup
MaxPower:                          0x32 = 100 mA

          ===>Interface Descriptor<===
bLength:                           0x09
bDescriptorType:                   0x04
bInterfaceNumber:                  0x00
bAlternateSetting:                 0x00
bNumEndpoints:                     0x01
bInterfaceClass:                   0x03  -> HID Interface Class
bInterfaceSubClass:                0x01
bInterfaceProtocol:                0x02
iInterface:                        0x00

          ===>HID Descriptor<===
bLength:                           0x09
bDescriptorType:                   0x21
bcdHID:                          0x0111
bCountryCode:                      0x00
bNumDescriptors:                   0x01
bDescriptorType:                   0x22 (Report Descriptor)
wDescriptorLength:               0x002E

          ===>Endpoint Descriptor<===
bLength:                           0x07
bDescriptorType:                   0x05
bEndpointAddress:                  0x81  -> Direction: IN - EndpointID: 1
bmAttributes:                      0x03  -> Interrupt Transfer Type
wMaxPacketSize:                  0x0004
bInterval:                         0x0A
[Port10]  :  USB Composite Device


Is Port User Connectable:         yes
Is Port Debug Capable:            no
Companion Port Number:            0
Companion Hub Symbolic Link Name: 
Protocols Supported:
 USB 1.1:                         yes
 USB 2.0:                         yes
 USB 3.0:                         no

Device Power State:               PowerDeviceD0

       ---===>Device Information<===---
English product name: "Logitech Webcam C930e"

ConnectionStatus:                  
Current Config Value:              0x01  -> Device Bus Speed: High (is not SuperSpeed or higher capable)
Device Address:                    0x26
Open Pipes:                           1

          ===>Device Descriptor<===
bLength:                           0x12
bDescriptorType:                   0x01
bcdUSB:                          0x0200
bDeviceClass:                      0xEF  -> This is a Multi-interface Function Code Device
bDeviceSubClass:                   0x02  -> This is the Common Class Sub Class
bDeviceProtocol:                   0x01  -> This is the Interface Association Descriptor protocol
bMaxPacketSize0:                   0x40 = (64) Bytes
idVendor:                        0x046D = Logitech Inc.
idProduct:                       0x0843
bcdDevice:                       0x0013
iManufacturer:                     0x00
iProduct:                          0x02
     English (United States)  "Logitech Webcam C930e"
iSerialNumber:                     0x00
bNumConfigurations:                0x01

          ---===>Open Pipes<===---

          ===>Endpoint Descriptor<===
bLength:                           0x07
bDescriptorType:                   0x05
bEndpointAddress:                  0x86  -> Direction: IN - EndpointID: 6
bmAttributes:                      0x03  -> Interrupt Transfer Type
wMaxPacketSize:                  0x0040 = 1 transactions per microframe, 0x40 max bytes
bInterval:                         0x08

       ---===>Full Configuration Descriptor<===---

          ===>Configuration Descriptor<===
bLength:                           0x09
bDescriptorType:                   0x02
wTotalLength:                    0x0A0D  -> Validated
bNumInterfaces:                    0x04
bConfigurationValue:               0x01
iConfiguration:                    0x00
bmAttributes:                      0x80  -> Bus Powered
MaxPower:                          0xFA = 500 mA

          ===>IAD Descriptor<===
bLength:                           0x08
bDescriptorType:                   0x0B
bFirstInterface:                   0x00
bInterfaceCount:                   0x02
bFunctionClass:                    0x0E  -> Video Interface Class
bFunctionSubClass:                 0x03  -> Video Interface Collection
bFunctionProtocol:                 0x00  -> PC_PROTOCOL_UNDEFINED protocol
iFunction:                         0x00

          ===>Interface Descriptor<===
bLength:                           0x09
bDescriptorType:                   0x04
bInterfaceNumber:                  0x00
bAlternateSetting:                 0x00
bNumEndpoints:                     0x01
bInterfaceClass:                   0x0E  -> Video Interface Class
bInterfaceSubClass:                0x01  -> Video Control Interface SubClass
bInterfaceProtocol:                0x00
iInterface:                        0x00

          ===>Class-Specific Video Control Interface Header Descriptor<===
bLength:                           0x0D
bDescriptorType:                   0x24
bDescriptorSubtype:                0x01
bcdVDC:                          0x0100
wTotalLength:                    0x00F1  -> Validated
dwClockFreq:                 0x01C9C380 = (30000000) Hz
bInCollection:                     0x01
baInterfaceNr[1]:                  0x01
USB Video Class device: spec version 1.0

          ===>Video Control Input Terminal Descriptor<===
bLength:                           0x12
bDescriptorType:                   0x24
bDescriptorSubtype:                0x02
bTerminalID:                       0x01
wTerminalType:                   0x0201 = (ITT_CAMERA)
bAssocTerminal:                    0x00
iTerminal:                         0x00
===>Camera Input Terminal Data
wObjectiveFocalLengthMin:        0x0000
wObjectiveFocalLengthMax:        0x0000
wOcularFocalLength:              0x0000
bControlSize:                      0x03
bmControls : 0x2E 0x0A 0x02 
     D00 = 0   no -  Scanning Mode
     D01 = 1  yes -  Auto-Exposure Mode
     D02 = 1  yes -  Auto-Exposure Priority
     D03 = 1  yes -  Exposure Time (Absolute)
     D04 = 0   no -  Exposure Time (Relative)
     D05 = 1  yes -  Focus (Absolute)
     D06 = 0   no -  Focus (Relative)
     D07 = 0   no -  Iris (Absolute)
     D08 = 0   no -  Iris (Relative)
     D09 = 1  yes -  Zoom (Absolute)
     D10 = 0   no -  Zoom (Relative)
     D11 = 1  yes -  PanTilt (Absolute)
     D12 = 0   no -  PanTilt (Relative)
     D13 = 0   no -  Roll (Absolute)
     D14 = 0   no -  Roll (Relative)
     D15 = 0   no -  Reserved
     D16 = 0   no -  Reserved
     D17 = 1  yes -  Focus, Auto
     D18 = 0   no -  Privacy
     D19 = 0   no -  Focus, Simple
     D20 = 0   no -  Window
     D21 = 0   no -  Region of Interest
     D22 = 0   no -  Reserved
     D23 = 0   no -  Reserved

          ===>Video Control Processing Unit Descriptor<===
bLength:                           0x0B
bDescriptorType:                   0x24
bDescriptorSubtype:                0x05
bUnitID:                           0x03
bSourceID:                         0x01
wMaxMultiplier:                  0x4000
bControlSize:                      0x02
bmControls : 0x5B 0x17 
     D00 = 1  yes -  Brightness
     D01 = 1  yes -  Contrast
     D02 = 0   no -  Hue
     D03 = 1  yes -  Saturation
     D04 = 1  yes -  Sharpness
     D05 = 0   no -  Gamma
     D06 = 1  yes -  White Balance Temperature
     D07 = 0   no -  White Balance Component
     D08 = 1  yes -  Backlight Compensation
     D09 = 1  yes -  Gain
     D10 = 1  yes -  Power Line Frequency
     D11 = 0   no -  Hue, Auto
     D12 = 1  yes -  White Balance Temperature, Auto
     D13 = 0   no -  White Balance Component, Auto
     D14 = 0   no -  Digital Multiplier
     D15 = 0   no -  Digital Multiplier Limit
iProcessing :                      0x00

          ===>Video Control Extension Unit Descriptor<===
bLength:                           0x1B
bDescriptorType:                   0x24
bDescriptorSubtype:                0x06
bUnitID:                           0x06
guidExtensionCode:                 {23E49ED0-1178-4F31-AE52-D2FB8A8D3B48}
bNumControls:                      0x0A
bNrInPins:                         0x01
===>List of Connected Units and Terminal ID's
baSourceID[1]:                     0x03
bControlSize:                      0x02
bmControls : 0xFF 0x03 
     D00 = 1  yes -  Vendor-Specific (Optional)
     D01 = 1  yes -  Vendor-Specific (Optional)
     D02 = 1  yes -  Vendor-Specific (Optional)
     D03 = 1  yes -  Vendor-Specific (Optional)
     D04 = 1  yes -  Vendor-Specific (Optional)
     D05 = 1  yes -  Vendor-Specific (Optional)
     D06 = 1  yes -  Vendor-Specific (Optional)
     D07 = 1  yes -  Vendor-Specific (Optional)
     D08 = 1  yes -  Vendor-Specific (Optional)
     D09 = 1  yes -  Vendor-Specific (Optional)
     D10 = 0   no -  Vendor-Specific (Optional)
     D11 = 0   no -  Vendor-Specific (Optional)
     D12 = 0   no -  Vendor-Specific (Optional)
     D13 = 0   no -  Vendor-Specific (Optional)
     D14 = 0   no -  Vendor-Specific (Optional)
     D15 = 0   no -  Vendor-Specific (Optional)
iExtension:                        0x00

          ===>Video Control Extension Unit Descriptor<===
bLength:                           0x1B
bDescriptorType:                   0x24
bDescriptorSubtype:                0x06
bUnitID:                           0x08
guidExtensionCode:                 {69678EE4-410F-40DB-A850-7420D7D8240E}
bNumControls:                      0x07
bNrInPins:                         0x01
===>List of Connected Units and Terminal ID's
baSourceID[1]:                     0x03
bControlSize:                      0x02
bmControls : 0x3B 0x03 
     D00 = 1  yes -  Vendor-Specific (Optional)
     D01 = 1  yes -  Vendor-Specific (Optional)
     D02 = 0   no -  Vendor-Specific (Optional)
     D03 = 1  yes -  Vendor-Specific (Optional)
     D04 = 1  yes -  Vendor-Specific (Optional)
     D05 = 1  yes -  Vendor-Specific (Optional)
     D06 = 0   no -  Vendor-Specific (Optional)
     D07 = 0   no -  Vendor-Specific (Optional)
     D08 = 1  yes -  Vendor-Specific (Optional)
     D09 = 1  yes -  Vendor-Specific (Optional)
     D10 = 0   no -  Vendor-Specific (Optional)
     D11 = 0   no -  Vendor-Specific (Optional)
     D12 = 0   no -  Vendor-Specific (Optional)
     D13 = 0   no -  Vendor-Specific (Optional)
     D14 = 0   no -  Vendor-Specific (Optional)
     D15 = 0   no -  Vendor-Specific (Optional)
iExtension:                        0x00

          ===>Video Control Extension Unit Descriptor<===
bLength:                           0x1C
bDescriptorType:                   0x24
bDescriptorSubtype:                0x06
bUnitID:                           0x09
guidExtensionCode:                 {1F5D4CA9-DE11-4487-840D-50933C8EC8D1}
bNumControls:                      0x10
bNrInPins:                         0x01
===>List of Connected Units and Terminal ID's
baSourceID[1]:                     0x03
bControlSize:                      0x03
bmControls : 0xF3 0xFF 0x03 
     D00 = 1  yes -  Vendor-Specific (Optional)
     D01 = 1  yes -  Vendor-Specific (Optional)
     D02 = 0   no -  Vendor-Specific (Optional)
     D03 = 0   no -  Vendor-Specific (Optional)
     D04 = 1  yes -  Vendor-Specific (Optional)
     D05 = 1  yes -  Vendor-Specific (Optional)
     D06 = 1  yes -  Vendor-Specific (Optional)
     D07 = 1  yes -  Vendor-Specific (Optional)
     D08 = 1  yes -  Vendor-Specific (Optional)
     D09 = 1  yes -  Vendor-Specific (Optional)
     D10 = 1  yes -  Vendor-Specific (Optional)
     D11 = 1  yes -  Vendor-Specific (Optional)
     D12 = 1  yes -  Vendor-Specific (Optional)
     D13 = 1  yes -  Vendor-Specific (Optional)
     D14 = 1  yes -  Vendor-Specific (Optional)
     D15 = 1  yes -  Vendor-Specific (Optional)
     D16 = 1  yes -  Vendor-Specific (Optional)
     D17 = 1  yes -  Vendor-Specific (Optional)
     D18 = 0   no -  Vendor-Specific (Optional)
     D19 = 0   no -  Vendor-Specific (Optional)
     D20 = 0   no -  Vendor-Specific (Optional)
     D21 = 0   no -  Vendor-Specific (Optional)
     D22 = 0   no -  Vendor-Specific (Optional)
     D23 = 0   no -  Vendor-Specific (Optional)
iExtension:                        0x00

          ===>Video Control Extension Unit Descriptor<===
bLength:                           0x1B
bDescriptorType:                   0x24
bDescriptorSubtype:                0x06
bUnitID:                           0x0A
guidExtensionCode:                 {49E40215-F434-47FE-B158-0E885023E51B}
bNumControls:                      0x07
bNrInPins:                         0x01
===>List of Connected Units and Terminal ID's
baSourceID[1]:                     0x03
bControlSize:                      0x02
bmControls : 0xAA 0x0F 
     D00 = 0   no -  Vendor-Specific (Optional)
     D01 = 1  yes -  Vendor-Specific (Optional)
     D02 = 0   no -  Vendor-Specific (Optional)
     D03 = 1  yes -  Vendor-Specific (Optional)
     D04 = 0   no -  Vendor-Specific (Optional)
     D05 = 1  yes -  Vendor-Specific (Optional)
     D06 = 0   no -  Vendor-Specific (Optional)
     D07 = 1  yes -  Vendor-Specific (Optional)
     D08 = 1  yes -  Vendor-Specific (Optional)
     D09 = 1  yes -  Vendor-Specific (Optional)
     D10 = 1  yes -  Vendor-Specific (Optional)
     D11 = 1  yes -  Vendor-Specific (Optional)
     D12 = 0   no -  Vendor-Specific (Optional)
     D13 = 0   no -  Vendor-Specific (Optional)
     D14 = 0   no -  Vendor-Specific (Optional)
     D15 = 0   no -  Vendor-Specific (Optional)
iExtension:                        0x00

          ===>Video Control Extension Unit Descriptor<===
bLength:                           0x1C
bDescriptorType:                   0x24
bDescriptorSubtype:                0x06
bUnitID:                           0x0B
guidExtensionCode:                 {FFE52D21-8030-4E2C-82D9-F587D00540BD}
bNumControls:                      0x03
bNrInPins:                         0x01
===>List of Connected Units and Terminal ID's
baSourceID[1]:                     0x03
bControlSize:                      0x03
bmControls : 0x00 0x41 0x01 
     D00 = 0   no -  Vendor-Specific (Optional)
     D01 = 0   no -  Vendor-Specific (Optional)
     D02 = 0   no -  Vendor-Specific (Optional)
     D03 = 0   no -  Vendor-Specific (Optional)
     D04 = 0   no -  Vendor-Specific (Optional)
     D05 = 0   no -  Vendor-Specific (Optional)
     D06 = 0   no -  Vendor-Specific (Optional)
     D07 = 0   no -  Vendor-Specific (Optional)
     D08 = 1  yes -  Vendor-Specific (Optional)
     D09 = 0   no -  Vendor-Specific (Optional)
     D10 = 0   no -  Vendor-Specific (Optional)
     D11 = 0   no -  Vendor-Specific (Optional)
     D12 = 0   no -  Vendor-Specific (Optional)
     D13 = 0   no -  Vendor-Specific (Optional)
     D14 = 1  yes -  Vendor-Specific (Optional)
     D15 = 0   no -  Vendor-Specific (Optional)
     D16 = 1  yes -  Vendor-Specific (Optional)
     D17 = 0   no -  Vendor-Specific (Optional)
     D18 = 0   no -  Vendor-Specific (Optional)
     D19 = 0   no -  Vendor-Specific (Optional)
     D20 = 0   no -  Vendor-Specific (Optional)
     D21 = 0   no -  Vendor-Specific (Optional)
     D22 = 0   no -  Vendor-Specific (Optional)
     D23 = 0   no -  Vendor-Specific (Optional)
iExtension:                        0x00

          ===>Video Control Extension Unit Descriptor<===
bLength:                           0x1B
bDescriptorType:                   0x24
bDescriptorSubtype:                0x06
bUnitID:                           0x0C
guidExtensionCode:                 {A29E7641-DE04-47E3-8B2B-F4341AFF003B}
bNumControls:                      0x0B
bNrInPins:                         0x01
===>List of Connected Units and Terminal ID's
baSourceID[1]:                     0x03
bControlSize:                      0x02
bmControls : 0x07 0x7F 
     D00 = 1  yes -  Vendor-Specific (Optional)
     D01 = 1  yes -  Vendor-Specific (Optional)
     D02 = 1  yes -  Vendor-Specific (Optional)
     D03 = 0   no -  Vendor-Specific (Optional)
     D04 = 0   no -  Vendor-Specific (Optional)
     D05 = 0   no -  Vendor-Specific (Optional)
     D06 = 0   no -  Vendor-Specific (Optional)
     D07 = 0   no -  Vendor-Specific (Optional)
     D08 = 1  yes -  Vendor-Specific (Optional)
     D09 = 1  yes -  Vendor-Specific (Optional)
     D10 = 1  yes -  Vendor-Specific (Optional)
     D11 = 1  yes -  Vendor-Specific (Optional)
     D12 = 1  yes -  Vendor-Specific (Optional)
     D13 = 1  yes -  Vendor-Specific (Optional)
     D14 = 1  yes -  Vendor-Specific (Optional)
     D15 = 0   no -  Vendor-Specific (Optional)
iExtension:                        0x00

          ===>Video Control Extension Unit Descriptor<===
bLength:                           0x1A
bDescriptorType:                   0x24
bDescriptorSubtype:                0x06
bUnitID:                           0x0D
guidExtensionCode:                 {13612D26-5AAA-46C4-B13D-FF4D9A60DB86}
bNumControls:                      0x01
bNrInPins:                         0x01
===>List of Connected Units and Terminal ID's
baSourceID[1]:                     0x03
bControlSize:                      0x01
bmControls : 0x02 
     D00 = 0   no -  Vendor-Specific (Optional)
     D01 = 1  yes -  Vendor-Specific (Optional)
     D02 = 0   no -  Vendor-Specific (Optional)
     D03 = 0   no -  Vendor-Specific (Optional)
     D04 = 0   no -  Vendor-Specific (Optional)
     D05 = 0   no -  Vendor-Specific (Optional)
     D06 = 0   no -  Vendor-Specific (Optional)
     D07 = 0   no -  Vendor-Specific (Optional)
iExtension:                        0x00

          ===>Video Control Output Terminal Descriptor<===
bLength:                           0x09
bDescriptorType:                   0x24
bDescriptorSubtype:                0x03
bTerminalID:                       0x04
wTerminalType:                   0x0101 = (TT_STREAMING)
bAssocTerminal:                    0x00
bSourceID:                         0x03
iTerminal:                         0x00

          ===>Endpoint Descriptor<===
bLength:                           0x07
bDescriptorType:                   0x05
bEndpointAddress:                  0x86  -> Direction: IN - EndpointID: 6
bmAttributes:                      0x03  -> Interrupt Transfer Type
wMaxPacketSize:                  0x0040 = 1 transactions per microframe, 0x40 max bytes
bInterval:                         0x08

          ===>Class-specific VC Interrupt Endpoint Descriptor<===
bLength:                           0x05 
bDescriptorType:                   0x25
bDescriptorSubtype:                0x03
wMaxTransferSize:                0x0040 = (64) Bytes

          ===>Interface Descriptor<===
bLength:                           0x09
bDescriptorType:                   0x04
bInterfaceNumber:                  0x01
bAlternateSetting:                 0x00
bNumEndpoints:                     0x00
bInterfaceClass:                   0x0E  -> Video Interface Class
bInterfaceSubClass:                0x02  -> Video Streaming Interface SubClass
bInterfaceProtocol:                0x00
iInterface:                        0x00

          ===>Video Class-Specific VS Video Input Header Descriptor<===
bLength:                           0x0F
bDescriptorType:                   0x24
bDescriptorSubtype:                0x01
bNumFormats:                       0x02
wTotalLength:                    0x0751  -> Validated
bEndpointAddress:                  0x81  -> Direction: IN - EndpointID: 1
bmInfo:                            0x00  -> Dynamic Format Change not Supported
bTerminalLink:                     0x04
bStillCaptureMethod:               0x00  -> No Still Capture
bTriggerSupport:                   0x00  -> No Hardware Triggering Support
bTriggerUsage:                     0x00
bControlSize:                      0x01
Video Payload Format 1             0x00 
     D00 = 0   no -  Key Frame Rate
     D01 = 0   no -  P Frame Rate
     D02 = 0   no -  Compression Quality
     D03 = 0   no -  Compression Window Size
     D04 = 0   no -  Generate Key Frame
     D05 = 0   no -  Update Frame Segment
     D06 = 0   no -  Reserved
     D07 = 0   no -  Reserved
Video Payload Format 2             0x04 
     D00 = 0   no -  Key Frame Rate
     D01 = 0   no -  P Frame Rate
     D02 = 1  yes -  Compression Quality
     D03 = 0   no -  Compression Window Size
     D04 = 0   no -  Generate Key Frame
     D05 = 0   no -  Update Frame Segment
     D06 = 0   no -  Reserved
     D07 = 0   no -  Reserved

          ===>Video Streaming Uncompressed Format Type Descriptor<===
bLength:                           0x1B
bDescriptorType:                   0x24
bDescriptorSubtype:                0x04
bFormatIndex:                      0x01
bNumFrameDescriptors:              0x13
guidFormat:                        {32595559-0000-0010-8000-00AA00389B71} = YUY2 Format
bBitsPerPixel:                     0x10
bDefaultFrameIndex:                0x01
bAspectRatioX:                     0x00
bAspectRatioY:                     0x00
bmInterlaceFlags:                  0x00
     D0    = 0x00 Interlaced stream or variable: No
     D1    = 0x00 Fields per frame: 2 fields
     D2    = 0x00 Field 1 first: No
     D3    = 0x00 Reserved
     D4..5 = 0x00 Field patterns  -> Field 1 only
     D6..7 = 0x00 Display Mode  -> Bob only
bCopyProtect:                      0x00  -> Duplication Unrestricted

          ===>Video Streaming Uncompressed Frame Type Descriptor<===
          --->This is the Default (optimum) Frame index
bLength:                           0x36
bDescriptorType:                   0x24
bDescriptorSubtype:                0x05
bFrameIndex:                       0x01
bmCapabilities:                    0x00
wWidth:                          0x0280 = 640
wHeight:                         0x01E0 = 480
dwMinBitRate:                0x01770000
dwMaxBitRate:                0x08CA0000
dwMaxVideoFrameBufferSize:   0x00096000
dwDefaultFrameInterval:      0x00051615 = 33.333300 mSec (30.00 Hz)
bFrameIntervalType:                0x07
===>Additional Discrete Frame Type Data
dwFrameInterval[1]:          0x00051615 = 33.333300 mSec (30.00 Hz)
dwFrameInterval[2]:          0x00065B9A = 41.666600 mSec (24.00 Hz)
dwFrameInterval[3]:          0x0007A120 = 50.000000 mSec (20.00 Hz)
dwFrameInterval[4]:          0x000A2C2A = 66.666600 mSec (15.00 Hz)
dwFrameInterval[5]:          0x000F4240 = 100.000000 mSec (10.00 Hz)
dwFrameInterval[6]:          0x00145855 = 133.333300 mSec (7.50 Hz)
dwFrameInterval[7]:          0x001E8480 = 200.000000 mSec (5.00 Hz)

          ===>Video Streaming Uncompressed Frame Type Descriptor<===
bLength:                           0x36
bDescriptorType:                   0x24
bDescriptorSubtype:                0x05
bFrameIndex:                       0x02
bmCapabilities:                    0x00
wWidth:                          0x00A0 = 160
wHeight:                         0x0078 = 120
dwMinBitRate:                0x00177000
dwMaxBitRate:                0x008CA000
dwMaxVideoFrameBufferSize:   0x00009600
dwDefaultFrameInterval:      0x00051615 = 33.333300 mSec (30.00 Hz)
bFrameIntervalType:                0x07
===>Additional Discrete Frame Type Data
dwFrameInterval[1]:          0x00051615 = 33.333300 mSec (30.00 Hz)
dwFrameInterval[2]:          0x00065B9A = 41.666600 mSec (24.00 Hz)
dwFrameInterval[3]:          0x0007A120 = 50.000000 mSec (20.00 Hz)
dwFrameInterval[4]:          0x000A2C2A = 66.666600 mSec (15.00 Hz)
dwFrameInterval[5]:          0x000F4240 = 100.000000 mSec (10.00 Hz)
dwFrameInterval[6]:          0x00145855 = 133.333300 mSec (7.50 Hz)
dwFrameInterval[7]:          0x001E8480 = 200.000000 mSec (5.00 Hz)

          ===>Video Streaming Uncompressed Frame Type Descriptor<===
bLength:                           0x36
bDescriptorType:                   0x24
bDescriptorSubtype:                0x05
bFrameIndex:                       0x03
bmCapabilities:                    0x00
wWidth:                          0x00B0 = 176
wHeight:                         0x0090 = 144
dwMinBitRate:                0x001EF000
dwMaxBitRate:                0x00B9A000
dwMaxVideoFrameBufferSize:   0x0000C600
dwDefaultFrameInterval:      0x00051615 = 33.333300 mSec (30.00 Hz)
bFrameIntervalType:                0x07
===>Additional Discrete Frame Type Data
dwFrameInterval[1]:          0x00051615 = 33.333300 mSec (30.00 Hz)
dwFrameInterval[2]:          0x00065B9A = 41.666600 mSec (24.00 Hz)
dwFrameInterval[3]:          0x0007A120 = 50.000000 mSec (20.00 Hz)
dwFrameInterval[4]:          0x000A2C2A = 66.666600 mSec (15.00 Hz)
dwFrameInterval[5]:          0x000F4240 = 100.000000 mSec (10.00 Hz)
dwFrameInterval[6]:          0x00145855 = 133.333300 mSec (7.50 Hz)
dwFrameInterval[7]:          0x001E8480 = 200.000000 mSec (5.00 Hz)

          ===>Video Streaming Uncompressed Frame Type Descriptor<===
bLength:                           0x36
bDescriptorType:                   0x24
bDescriptorSubtype:                0x05
bFrameIndex:                       0x04
bmCapabilities:                    0x00
wWidth:                          0x0140 = 320
wHeight:                         0x00B4 = 180
dwMinBitRate:                0x00465000
dwMaxBitRate:                0x01A5E000
dwMaxVideoFrameBufferSize:   0x0001C200
dwDefaultFrameInterval:      0x00051615 = 33.333300 mSec (30.00 Hz)
bFrameIntervalType:                0x07
===>Additional Discrete Frame Type Data
dwFrameInterval[1]:          0x00051615 = 33.333300 mSec (30.00 Hz)
dwFrameInterval[2]:          0x00065B9A = 41.666600 mSec (24.00 Hz)
dwFrameInterval[3]:          0x0007A120 = 50.000000 mSec (20.00 Hz)
dwFrameInterval[4]:          0x000A2C2A = 66.666600 mSec (15.00 Hz)
dwFrameInterval[5]:          0x000F4240 = 100.000000 mSec (10.00 Hz)
dwFrameInterval[6]:          0x00145855 = 133.333300 mSec (7.50 Hz)
dwFrameInterval[7]:          0x001E8480 = 200.000000 mSec (5.00 Hz)

          ===>Video Streaming Uncompressed Frame Type Descriptor<===
bLength:                           0x36
bDescriptorType:                   0x24
bDescriptorSubtype:                0x05
bFrameIndex:                       0x05
bmCapabilities:                    0x00
wWidth:                          0x0140 = 320
wHeight:                         0x00F0 = 240
dwMinBitRate:                0x005DC000
dwMaxBitRate:                0x02328000
dwMaxVideoFrameBufferSize:   0x00025800
dwDefaultFrameInterval:      0x00051615 = 33.333300 mSec (30.00 Hz)
bFrameIntervalType:                0x07
===>Additional Discrete Frame Type Data
dwFrameInterval[1]:          0x00051615 = 33.333300 mSec (30.00 Hz)
dwFrameInterval[2]:          0x00065B9A = 41.666600 mSec (24.00 Hz)
dwFrameInterval[3]:          0x0007A120 = 50.000000 mSec (20.00 Hz)
dwFrameInterval[4]:          0x000A2C2A = 66.666600 mSec (15.00 Hz)
dwFrameInterval[5]:          0x000F4240 = 100.000000 mSec (10.00 Hz)
dwFrameInterval[6]:          0x00145855 = 133.333300 mSec (7.50 Hz)
dwFrameInterval[7]:          0x001E8480 = 200.000000 mSec (5.00 Hz)

          ===>Video Streaming Uncompressed Frame Type Descriptor<===
bLength:                           0x36
bDescriptorType:                   0x24
bDescriptorSubtype:                0x05
bFrameIndex:                       0x06
bmCapabilities:                    0x00
wWidth:                          0x0160 = 352
wHeight:                         0x0120 = 288
dwMinBitRate:                0x007BC000
dwMaxBitRate:                0x02E68000
dwMaxVideoFrameBufferSize:   0x00031800
dwDefaultFrameInterval:      0x00051615 = 33.333300 mSec (30.00 Hz)
bFrameIntervalType:                0x07
===>Additional Discrete Frame Type Data
dwFrameInterval[1]:          0x00051615 = 33.333300 mSec (30.00 Hz)
dwFrameInterval[2]:          0x00065B9A = 41.666600 mSec (24.00 Hz)
dwFrameInterval[3]:          0x0007A120 = 50.000000 mSec (20.00 Hz)
dwFrameInterval[4]:          0x000A2C2A = 66.666600 mSec (15.00 Hz)
dwFrameInterval[5]:          0x000F4240 = 100.000000 mSec (10.00 Hz)
dwFrameInterval[6]:          0x00145855 = 133.333300 mSec (7.50 Hz)
dwFrameInterval[7]:          0x001E8480 = 200.000000 mSec (5.00 Hz)

          ===>Video Streaming Uncompressed Frame Type Descriptor<===
bLength:                           0x36
bDescriptorType:                   0x24
bDescriptorSubtype:                0x05
bFrameIndex:                       0x07
bmCapabilities:                    0x00
wWidth:                          0x01A8 = 424
wHeight:                         0x00F0 = 240
dwMinBitRate:                0x007C3800
dwMaxBitRate:                0x02E95000
dwMaxVideoFrameBufferSize:   0x00031B00
dwDefaultFrameInterval:      0x00051615 = 33.333300 mSec (30.00 Hz)
bFrameIntervalType:                0x07
===>Additional Discrete Frame Type Data
dwFrameInterval[1]:          0x00051615 = 33.333300 mSec (30.00 Hz)
dwFrameInterval[2]:          0x00065B9A = 41.666600 mSec (24.00 Hz)
dwFrameInterval[3]:          0x0007A120 = 50.000000 mSec (20.00 Hz)
dwFrameInterval[4]:          0x000A2C2A = 66.666600 mSec (15.00 Hz)
dwFrameInterval[5]:          0x000F4240 = 100.000000 mSec (10.00 Hz)
dwFrameInterval[6]:          0x00145855 = 133.333300 mSec (7.50 Hz)
dwFrameInterval[7]:          0x001E8480 = 200.000000 mSec (5.00 Hz)

          ===>Video Streaming Uncompressed Frame Type Descriptor<===
bLength:                           0x36
bDescriptorType:                   0x24
bDescriptorSubtype:                0x05
bFrameIndex:                       0x08
bmCapabilities:                    0x00
wWidth:                          0x01E0 = 480
wHeight:                         0x010E = 270
dwMinBitRate:                0x009E3400
dwMaxBitRate:                0x03B53800
dwMaxVideoFrameBufferSize:   0x0003F480
dwDefaultFrameInterval:      0x00051615 = 33.333300 mSec (30.00 Hz)
bFrameIntervalType:                0x07
===>Additional Discrete Frame Type Data
dwFrameInterval[1]:          0x00051615 = 33.333300 mSec (30.00 Hz)
dwFrameInterval[2]:          0x00065B9A = 41.666600 mSec (24.00 Hz)
dwFrameInterval[3]:          0x0007A120 = 50.000000 mSec (20.00 Hz)
dwFrameInterval[4]:          0x000A2C2A = 66.666600 mSec (15.00 Hz)
dwFrameInterval[5]:          0x000F4240 = 100.000000 mSec (10.00 Hz)
dwFrameInterval[6]:          0x00145855 = 133.333300 mSec (7.50 Hz)
dwFrameInterval[7]:          0x001E8480 = 200.000000 mSec (5.00 Hz)

          ===>Video Streaming Uncompressed Frame Type Descriptor<===
bLength:                           0x36
bDescriptorType:                   0x24
bDescriptorSubtype:                0x05
bFrameIndex:                       0x09
bmCapabilities:                    0x00
wWidth:                          0x0280 = 640
wHeight:                         0x0168 = 360
dwMinBitRate:                0x01194000
dwMaxBitRate:                0x06978000
dwMaxVideoFrameBufferSize:   0x00070800
dwDefaultFrameInterval:      0x00051615 = 33.333300 mSec (30.00 Hz)
bFrameIntervalType:                0x07
===>Additional Discrete Frame Type Data
dwFrameInterval[1]:          0x00051615 = 33.333300 mSec (30.00 Hz)
dwFrameInterval[2]:          0x00065B9A = 41.666600 mSec (24.00 Hz)
dwFrameInterval[3]:          0x0007A120 = 50.000000 mSec (20.00 Hz)
dwFrameInterval[4]:          0x000A2C2A = 66.666600 mSec (15.00 Hz)
dwFrameInterval[5]:          0x000F4240 = 100.000000 mSec (10.00 Hz)
dwFrameInterval[6]:          0x00145855 = 133.333300 mSec (7.50 Hz)
dwFrameInterval[7]:          0x001E8480 = 200.000000 mSec (5.00 Hz)

          ===>Video Streaming Uncompressed Frame Type Descriptor<===
bLength:                           0x36
bDescriptorType:                   0x24
bDescriptorSubtype:                0x05
bFrameIndex:                       0x0A
bmCapabilities:                    0x00
wWidth:                          0x0320 = 800
wHeight:                         0x01C0 = 448
dwMinBitRate:                0x01B58000
dwMaxBitRate:                0x0A410000
dwMaxVideoFrameBufferSize:   0x000AF000
dwDefaultFrameInterval:      0x00051615 = 33.333300 mSec (30.00 Hz)
bFrameIntervalType:                0x07
===>Additional Discrete Frame Type Data
dwFrameInterval[1]:          0x00051615 = 33.333300 mSec (30.00 Hz)
dwFrameInterval[2]:          0x00065B9A = 41.666600 mSec (24.00 Hz)
dwFrameInterval[3]:          0x0007A120 = 50.000000 mSec (20.00 Hz)
dwFrameInterval[4]:          0x000A2C2A = 66.666600 mSec (15.00 Hz)
dwFrameInterval[5]:          0x000F4240 = 100.000000 mSec (10.00 Hz)
dwFrameInterval[6]:          0x00145855 = 133.333300 mSec (7.50 Hz)
dwFrameInterval[7]:          0x001E8480 = 200.000000 mSec (5.00 Hz)

          ===>Video Streaming Uncompressed Frame Type Descriptor<===
bLength:                           0x32
bDescriptorType:                   0x24
bDescriptorSubtype:                0x05
bFrameIndex:                       0x0B
bmCapabilities:                    0x00
wWidth:                          0x0320 = 800
wHeight:                         0x0258 = 600
dwMinBitRate:                0x0249F000
dwMaxBitRate:                0x0AFC8000
dwMaxVideoFrameBufferSize:   0x000EA600
dwDefaultFrameInterval:      0x00065B9A = 41.666600 mSec (24.00 Hz)
bFrameIntervalType:                0x06
===>Additional Discrete Frame Type Data
dwFrameInterval[1]:          0x00065B9A = 41.666600 mSec (24.00 Hz)
dwFrameInterval[2]:          0x0007A120 = 50.000000 mSec (20.00 Hz)
dwFrameInterval[3]:          0x000A2C2A = 66.666600 mSec (15.00 Hz)
dwFrameInterval[4]:          0x000F4240 = 100.000000 mSec (10.00 Hz)
dwFrameInterval[5]:          0x00145855 = 133.333300 mSec (7.50 Hz)
dwFrameInterval[6]:          0x001E8480 = 200.000000 mSec (5.00 Hz)

          ===>Video Streaming Uncompressed Frame Type Descriptor<===
bLength:                           0x36
bDescriptorType:                   0x24
bDescriptorSubtype:                0x05
bFrameIndex:                       0x0C
bmCapabilities:                    0x00
wWidth:                          0x0350 = 848
wHeight:                         0x01E0 = 480
dwMinBitRate:                0x01F0E000
dwMaxBitRate:                0x0BA54000
dwMaxVideoFrameBufferSize:   0x000C6C00
dwDefaultFrameInterval:      0x00051615 = 33.333300 mSec (30.00 Hz)
bFrameIntervalType:                0x07
===>Additional Discrete Frame Type Data
dwFrameInterval[1]:          0x00051615 = 33.333300 mSec (30.00 Hz)
dwFrameInterval[2]:          0x00065B9A = 41.666600 mSec (24.00 Hz)
dwFrameInterval[3]:          0x0007A120 = 50.000000 mSec (20.00 Hz)
dwFrameInterval[4]:          0x000A2C2A = 66.666600 mSec (15.00 Hz)
dwFrameInterval[5]:          0x000F4240 = 100.000000 mSec (10.00 Hz)
dwFrameInterval[6]:          0x00145855 = 133.333300 mSec (7.50 Hz)
dwFrameInterval[7]:          0x001E8480 = 200.000000 mSec (5.00 Hz)

          ===>Video Streaming Uncompressed Frame Type Descriptor<===
bLength:                           0x2A
bDescriptorType:                   0x24
bDescriptorSubtype:                0x05
bFrameIndex:                       0x0D
bmCapabilities:                    0x00
wWidth:                          0x03C0 = 960
wHeight:                         0x021C = 540
dwMinBitRate:                0x0278D000
dwMaxBitRate:                0x076A7000
dwMaxVideoFrameBufferSize:   0x000FD200
dwDefaultFrameInterval:      0x000A2C2A = 66.666600 mSec (15.00 Hz)
bFrameIntervalType:                0x04
===>Additional Discrete Frame Type Data
dwFrameInterval[1]:          0x000A2C2A = 66.666600 mSec (15.00 Hz)
dwFrameInterval[2]:          0x000F4240 = 100.000000 mSec (10.00 Hz)
dwFrameInterval[3]:          0x00145855 = 133.333300 mSec (7.50 Hz)
dwFrameInterval[4]:          0x001E8480 = 200.000000 mSec (5.00 Hz)

          ===>Video Streaming Uncompressed Frame Type Descriptor<===
bLength:                           0x2A
bDescriptorType:                   0x24
bDescriptorSubtype:                0x05
bFrameIndex:                       0x0E
bmCapabilities:                    0x00
wWidth:                          0x0400 = 1024
wHeight:                         0x0240 = 576
dwMinBitRate:                0x02D00000
dwMaxBitRate:                0x08700000
dwMaxVideoFrameBufferSize:   0x00120000
dwDefaultFrameInterval:      0x000A2C2A = 66.666600 mSec (15.00 Hz)
bFrameIntervalType:                0x04
===>Additional Discrete Frame Type Data
dwFrameInterval[1]:          0x000A2C2A = 66.666600 mSec (15.00 Hz)
dwFrameInterval[2]:          0x000F4240 = 100.000000 mSec (10.00 Hz)
dwFrameInterval[3]:          0x00145855 = 133.333300 mSec (7.50 Hz)
dwFrameInterval[4]:          0x001E8480 = 200.000000 mSec (5.00 Hz)

          ===>Video Streaming Uncompressed Frame Type Descriptor<===
bLength:                           0x26
bDescriptorType:                   0x24
bDescriptorSubtype:                0x05
bFrameIndex:                       0x0F
bmCapabilities:                    0x00
wWidth:                          0x0500 = 1280
wHeight:                         0x02D0 = 720
dwMinBitRate:                0x04650000
dwMaxBitRate:                0x08CA0000
dwMaxVideoFrameBufferSize:   0x001C2000
dwDefaultFrameInterval:      0x000F4240 = 100.000000 mSec (10.00 Hz)
bFrameIntervalType:                0x03
===>Additional Discrete Frame Type Data
dwFrameInterval[1]:          0x000F4240 = 100.000000 mSec (10.00 Hz)
dwFrameInterval[2]:          0x00145855 = 133.333300 mSec (7.50 Hz)
dwFrameInterval[3]:          0x001E8480 = 200.000000 mSec (5.00 Hz)

          ===>Video Streaming Uncompressed Frame Type Descriptor<===
bLength:                           0x22
bDescriptorType:                   0x24
bDescriptorSubtype:                0x05
bFrameIndex:                       0x10
bmCapabilities:                    0x00
wWidth:                          0x0640 = 1600
wHeight:                         0x0380 = 896
dwMinBitRate:                0x06D60000
dwMaxBitRate:                0x0A410000
dwMaxVideoFrameBufferSize:   0x002BC000
dwDefaultFrameInterval:      0x00145855 = 133.333300 mSec (7.50 Hz)
bFrameIntervalType:                0x02
===>Additional Discrete Frame Type Data
dwFrameInterval[1]:          0x00145855 = 133.333300 mSec (7.50 Hz)
dwFrameInterval[2]:          0x001E8480 = 200.000000 mSec (5.00 Hz)

          ===>Video Streaming Uncompressed Frame Type Descriptor<===
bLength:                           0x1E
bDescriptorType:                   0x24
bDescriptorSubtype:                0x05
bFrameIndex:                       0x11
bmCapabilities:                    0x00
wWidth:                          0x0780 = 1920
wHeight:                         0x0438 = 1080
dwMinBitRate:                0x09E34000
dwMaxBitRate:                0x09E34000
dwMaxVideoFrameBufferSize:   0x003F4800
dwDefaultFrameInterval:      0x001E8480 = 200.000000 mSec (5.00 Hz)
bFrameIntervalType:                0x01
===>Additional Discrete Frame Type Data
dwFrameInterval[1]:          0x001E8480 = 200.000000 mSec (5.00 Hz)

          ===>Video Streaming Uncompressed Frame Type Descriptor<===
bLength:                           0x1E
bDescriptorType:                   0x24
bDescriptorSubtype:                0x05
bFrameIndex:                       0x12
bmCapabilities:                    0x00
wWidth:                          0x0900 = 2304
wHeight:                         0x0510 = 1296
dwMinBitRate:                0x0E3D0000
dwMaxBitRate:                0x0E3D0000
dwMaxVideoFrameBufferSize:   0x005B2000
dwDefaultFrameInterval:      0x004C4B3E = 499.999800 mSec (2.00 Hz)
bFrameIntervalType:                0x01
===>Additional Discrete Frame Type Data
dwFrameInterval[1]:          0x004C4B3E = 499.999800 mSec (2.00 Hz)

          ===>Video Streaming Uncompressed Frame Type Descriptor<===
bLength:                           0x1E
bDescriptorType:                   0x24
bDescriptorSubtype:                0x05
bFrameIndex:                       0x13
bmCapabilities:                    0x00
wWidth:                          0x0900 = 2304
wHeight:                         0x0600 = 1536
dwMinBitRate:                0x10E00000
dwMaxBitRate:                0x10E00000
dwMaxVideoFrameBufferSize:   0x006C0000
dwDefaultFrameInterval:      0x004C4B3E = 499.999800 mSec (2.00 Hz)
bFrameIntervalType:                0x01
===>Additional Discrete Frame Type Data
dwFrameInterval[1]:          0x004C4B3E = 499.999800 mSec (2.00 Hz)

          ===>Color Matching Descriptor<===
bLength:                           0x06
bDescriptorType:                   0x24
bDescriptorSubtype:                0x0D
bColorPrimaries:                   0x01
bTransferCharacteristics:          0x01
bMatrixCoefficients:               0x04

          ===>Video Streaming MJPEG Format Type Descriptor<===
bLength:                           0x0B
bDescriptorType:                   0x24
bDescriptorSubtype:                0x06
bFormatIndex:                      0x02
bNumFrameDescriptors:              0x11
bmFlags:                           0x01  -> Sample Size is Fixed
bDefaultFrameIndex:                0x01
bAspectRatioX:                     0x00
bAspectRatioY:                     0x00
bmInterlaceFlags:                  0x00
     D00   = 0  non-Interlaced stream or variable
     D01   = 0  2 fields per frame
     D02   = 0  Field 1 not first
     D03   = 0  Reserved
     D4..5 = 0  Field patterns  -> Field 1 only
     D6..7 = 0  Display Mode  -> Bob only
bCopyProtect:                      0x00  -> Duplication Unrestricted

          ===>Video Streaming MJPEG Frame Type Descriptor<===
          --->This is the Default (optimum) Frame index
bLength:                           0x36
bDescriptorType:                   0x24
bDescriptorSubtype:                0x07
bFrameIndex:                       0x01
bmCapabilities:                    0x00
wWidth:                          0x0280 = 640
wHeight:                         0x01E0 = 480
dwMinBitRate:                0x01770000
dwMaxBitRate:                0x08CA0000
dwMaxVideoFrameBufferSize:   0x00096000
dwDefaultFrameInterval:      0x00051615 = 33.333300 mSec (30.00 Hz)
bFrameIntervalType:                0x07
===>Additional Discrete Frame TypeData
dwFrameInterval[1]:          0x00051615 = 33.333300 mSec (30.00 Hz)
dwFrameInterval[2]:          0x00065B9A = 41.666600 mSec (24.00 Hz)
dwFrameInterval[3]:          0x0007A120 = 50.000000 mSec (20.00 Hz)
dwFrameInterval[4]:          0x000A2C2A = 66.666600 mSec (15.00 Hz)
dwFrameInterval[5]:          0x000F4240 = 100.000000 mSec (10.00 Hz)
dwFrameInterval[6]:          0x00145855 = 133.333300 mSec (7.50 Hz)
dwFrameInterval[7]:          0x001E8480 = 200.000000 mSec (5.00 Hz)

          ===>Video Streaming MJPEG Frame Type Descriptor<===
bLength:                           0x36
bDescriptorType:                   0x24
bDescriptorSubtype:                0x07
bFrameIndex:                       0x02
bmCapabilities:                    0x00
wWidth:                          0x00A0 = 160
wHeight:                         0x0078 = 120
dwMinBitRate:                0x00177000
dwMaxBitRate:                0x008CA000
dwMaxVideoFrameBufferSize:   0x00009600
dwDefaultFrameInterval:      0x00051615 = 33.333300 mSec (30.00 Hz)
bFrameIntervalType:                0x07
===>Additional Discrete Frame TypeData
dwFrameInterval[1]:          0x00051615 = 33.333300 mSec (30.00 Hz)
dwFrameInterval[2]:          0x00065B9A = 41.666600 mSec (24.00 Hz)
dwFrameInterval[3]:          0x0007A120 = 50.000000 mSec (20.00 Hz)
dwFrameInterval[4]:          0x000A2C2A = 66.666600 mSec (15.00 Hz)
dwFrameInterval[5]:          0x000F4240 = 100.000000 mSec (10.00 Hz)
dwFrameInterval[6]:          0x00145855 = 133.333300 mSec (7.50 Hz)
dwFrameInterval[7]:          0x001E8480 = 200.000000 mSec (5.00 Hz)

          ===>Video Streaming MJPEG Frame Type Descriptor<===
bLength:                           0x36
bDescriptorType:                   0x24
bDescriptorSubtype:                0x07
bFrameIndex:                       0x03
bmCapabilities:                    0x00
wWidth:                          0x00B0 = 176
wHeight:                         0x0090 = 144
dwMinBitRate:                0x001EF000
dwMaxBitRate:                0x00B9A000
dwMaxVideoFrameBufferSize:   0x0000C600
dwDefaultFrameInterval:      0x00051615 = 33.333300 mSec (30.00 Hz)
bFrameIntervalType:                0x07
===>Additional Discrete Frame TypeData
dwFrameInterval[1]:          0x00051615 = 33.333300 mSec (30.00 Hz)
dwFrameInterval[2]:          0x00065B9A = 41.666600 mSec (24.00 Hz)
dwFrameInterval[3]:          0x0007A120 = 50.000000 mSec (20.00 Hz)
dwFrameInterval[4]:          0x000A2C2A = 66.666600 mSec (15.00 Hz)
dwFrameInterval[5]:          0x000F4240 = 100.000000 mSec (10.00 Hz)
dwFrameInterval[6]:          0x00145855 = 133.333300 mSec (7.50 Hz)
dwFrameInterval[7]:          0x001E8480 = 200.000000 mSec (5.00 Hz)

          ===>Video Streaming MJPEG Frame Type Descriptor<===
bLength:                           0x36
bDescriptorType:                   0x24
bDescriptorSubtype:                0x07
bFrameIndex:                       0x04
bmCapabilities:                    0x00
wWidth:                          0x0140 = 320
wHeight:                         0x00B4 = 180
dwMinBitRate:                0x00465000
dwMaxBitRate:                0x01A5E000
dwMaxVideoFrameBufferSize:   0x0001C200
dwDefaultFrameInterval:      0x00051615 = 33.333300 mSec (30.00 Hz)
bFrameIntervalType:                0x07
===>Additional Discrete Frame TypeData
dwFrameInterval[1]:          0x00051615 = 33.333300 mSec (30.00 Hz)
dwFrameInterval[2]:          0x00065B9A = 41.666600 mSec (24.00 Hz)
dwFrameInterval[3]:          0x0007A120 = 50.000000 mSec (20.00 Hz)
dwFrameInterval[4]:          0x000A2C2A = 66.666600 mSec (15.00 Hz)
dwFrameInterval[5]:          0x000F4240 = 100.000000 mSec (10.00 Hz)
dwFrameInterval[6]:          0x00145855 = 133.333300 mSec (7.50 Hz)
dwFrameInterval[7]:          0x001E8480 = 200.000000 mSec (5.00 Hz)

          ===>Video Streaming MJPEG Frame Type Descriptor<===
bLength:                           0x36
bDescriptorType:                   0x24
bDescriptorSubtype:                0x07
bFrameIndex:                       0x05
bmCapabilities:                    0x00
wWidth:                          0x0140 = 320
wHeight:                         0x00F0 = 240
dwMinBitRate:                0x005DC000
dwMaxBitRate:                0x02328000
dwMaxVideoFrameBufferSize:   0x00025800
dwDefaultFrameInterval:      0x00051615 = 33.333300 mSec (30.00 Hz)
bFrameIntervalType:                0x07
===>Additional Discrete Frame TypeData
dwFrameInterval[1]:          0x00051615 = 33.333300 mSec (30.00 Hz)
dwFrameInterval[2]:          0x00065B9A = 41.666600 mSec (24.00 Hz)
dwFrameInterval[3]:          0x0007A120 = 50.000000 mSec (20.00 Hz)
dwFrameInterval[4]:          0x000A2C2A = 66.666600 mSec (15.00 Hz)
dwFrameInterval[5]:          0x000F4240 = 100.000000 mSec (10.00 Hz)
dwFrameInterval[6]:          0x00145855 = 133.333300 mSec (7.50 Hz)
dwFrameInterval[7]:          0x001E8480 = 200.000000 mSec (5.00 Hz)

          ===>Video Streaming MJPEG Frame Type Descriptor<===
bLength:                           0x36
bDescriptorType:                   0x24
bDescriptorSubtype:                0x07
bFrameIndex:                       0x06
bmCapabilities:                    0x00
wWidth:                          0x0160 = 352
wHeight:                         0x0120 = 288
dwMinBitRate:                0x007BC000
dwMaxBitRate:                0x02E68000
dwMaxVideoFrameBufferSize:   0x00031800
dwDefaultFrameInterval:      0x00051615 = 33.333300 mSec (30.00 Hz)
bFrameIntervalType:                0x07
===>Additional Discrete Frame TypeData
dwFrameInterval[1]:          0x00051615 = 33.333300 mSec (30.00 Hz)
dwFrameInterval[2]:          0x00065B9A = 41.666600 mSec (24.00 Hz)
dwFrameInterval[3]:          0x0007A120 = 50.000000 mSec (20.00 Hz)
dwFrameInterval[4]:          0x000A2C2A = 66.666600 mSec (15.00 Hz)
dwFrameInterval[5]:          0x000F4240 = 100.000000 mSec (10.00 Hz)
dwFrameInterval[6]:          0x00145855 = 133.333300 mSec (7.50 Hz)
dwFrameInterval[7]:          0x001E8480 = 200.000000 mSec (5.00 Hz)

          ===>Video Streaming MJPEG Frame Type Descriptor<===
bLength:                           0x36
bDescriptorType:                   0x24
bDescriptorSubtype:                0x07
bFrameIndex:                       0x07
bmCapabilities:                    0x00
wWidth:                          0x01A8 = 424
wHeight:                         0x00F0 = 240
dwMinBitRate:                0x007C3800
dwMaxBitRate:                0x02E95000
dwMaxVideoFrameBufferSize:   0x00031B00
dwDefaultFrameInterval:      0x00051615 = 33.333300 mSec (30.00 Hz)
bFrameIntervalType:                0x07
===>Additional Discrete Frame TypeData
dwFrameInterval[1]:          0x00051615 = 33.333300 mSec (30.00 Hz)
dwFrameInterval[2]:          0x00065B9A = 41.666600 mSec (24.00 Hz)
dwFrameInterval[3]:          0x0007A120 = 50.000000 mSec (20.00 Hz)
dwFrameInterval[4]:          0x000A2C2A = 66.666600 mSec (15.00 Hz)
dwFrameInterval[5]:          0x000F4240 = 100.000000 mSec (10.00 Hz)
dwFrameInterval[6]:          0x00145855 = 133.333300 mSec (7.50 Hz)
dwFrameInterval[7]:          0x001E8480 = 200.000000 mSec (5.00 Hz)

          ===>Video Streaming MJPEG Frame Type Descriptor<===
bLength:                           0x36
bDescriptorType:                   0x24
bDescriptorSubtype:                0x07
bFrameIndex:                       0x08
bmCapabilities:                    0x00
wWidth:                          0x01E0 = 480
wHeight:                         0x010E = 270
dwMinBitRate:                0x009E3400
dwMaxBitRate:                0x03B53800
dwMaxVideoFrameBufferSize:   0x0003F480
dwDefaultFrameInterval:      0x00051615 = 33.333300 mSec (30.00 Hz)
bFrameIntervalType:                0x07
===>Additional Discrete Frame TypeData
dwFrameInterval[1]:          0x00051615 = 33.333300 mSec (30.00 Hz)
dwFrameInterval[2]:          0x00065B9A = 41.666600 mSec (24.00 Hz)
dwFrameInterval[3]:          0x0007A120 = 50.000000 mSec (20.00 Hz)
dwFrameInterval[4]:          0x000A2C2A = 66.666600 mSec (15.00 Hz)
dwFrameInterval[5]:          0x000F4240 = 100.000000 mSec (10.00 Hz)
dwFrameInterval[6]:          0x00145855 = 133.333300 mSec (7.50 Hz)
dwFrameInterval[7]:          0x001E8480 = 200.000000 mSec (5.00 Hz)

          ===>Video Streaming MJPEG Frame Type Descriptor<===
bLength:                           0x36
bDescriptorType:                   0x24
bDescriptorSubtype:                0x07
bFrameIndex:                       0x09
bmCapabilities:                    0x00
wWidth:                          0x0280 = 640
wHeight:                         0x0168 = 360
dwMinBitRate:                0x01194000
dwMaxBitRate:                0x06978000
dwMaxVideoFrameBufferSize:   0x00070800
dwDefaultFrameInterval:      0x00051615 = 33.333300 mSec (30.00 Hz)
bFrameIntervalType:                0x07
===>Additional Discrete Frame TypeData
dwFrameInterval[1]:          0x00051615 = 33.333300 mSec (30.00 Hz)
dwFrameInterval[2]:          0x00065B9A = 41.666600 mSec (24.00 Hz)
dwFrameInterval[3]:          0x0007A120 = 50.000000 mSec (20.00 Hz)
dwFrameInterval[4]:          0x000A2C2A = 66.666600 mSec (15.00 Hz)
dwFrameInterval[5]:          0x000F4240 = 100.000000 mSec (10.00 Hz)
dwFrameInterval[6]:          0x00145855 = 133.333300 mSec (7.50 Hz)
dwFrameInterval[7]:          0x001E8480 = 200.000000 mSec (5.00 Hz)

          ===>Video Streaming MJPEG Frame Type Descriptor<===
bLength:                           0x36
bDescriptorType:                   0x24
bDescriptorSubtype:                0x07
bFrameIndex:                       0x0A
bmCapabilities:                    0x00
wWidth:                          0x0320 = 800
wHeight:                         0x01C0 = 448
dwMinBitRate:                0x01B58000
dwMaxBitRate:                0x0A410000
dwMaxVideoFrameBufferSize:   0x000AF000
dwDefaultFrameInterval:      0x00051615 = 33.333300 mSec (30.00 Hz)
bFrameIntervalType:                0x07
===>Additional Discrete Frame TypeData
dwFrameInterval[1]:          0x00051615 = 33.333300 mSec (30.00 Hz)
dwFrameInterval[2]:          0x00065B9A = 41.666600 mSec (24.00 Hz)
dwFrameInterval[3]:          0x0007A120 = 50.000000 mSec (20.00 Hz)
dwFrameInterval[4]:          0x000A2C2A = 66.666600 mSec (15.00 Hz)
dwFrameInterval[5]:          0x000F4240 = 100.000000 mSec (10.00 Hz)
dwFrameInterval[6]:          0x00145855 = 133.333300 mSec (7.50 Hz)
dwFrameInterval[7]:          0x001E8480 = 200.000000 mSec (5.00 Hz)

          ===>Video Streaming MJPEG Frame Type Descriptor<===
bLength:                           0x36
bDescriptorType:                   0x24
bDescriptorSubtype:                0x07
bFrameIndex:                       0x0B
bmCapabilities:                    0x00
wWidth:                          0x0320 = 800
wHeight:                         0x0258 = 600
dwMinBitRate:                0x0249F000
dwMaxBitRate:                0x0DBBA000
dwMaxVideoFrameBufferSize:   0x000EA600
dwDefaultFrameInterval:      0x00051615 = 33.333300 mSec (30.00 Hz)
bFrameIntervalType:                0x07
===>Additional Discrete Frame TypeData
dwFrameInterval[1]:          0x00051615 = 33.333300 mSec (30.00 Hz)
dwFrameInterval[2]:          0x00065B9A = 41.666600 mSec (24.00 Hz)
dwFrameInterval[3]:          0x0007A120 = 50.000000 mSec (20.00 Hz)
dwFrameInterval[4]:          0x000A2C2A = 66.666600 mSec (15.00 Hz)
dwFrameInterval[5]:          0x000F4240 = 100.000000 mSec (10.00 Hz)
dwFrameInterval[6]:          0x00145855 = 133.333300 mSec (7.50 Hz)
dwFrameInterval[7]:          0x001E8480 = 200.000000 mSec (5.00 Hz)

          ===>Video Streaming MJPEG Frame Type Descriptor<===
bLength:                           0x36
bDescriptorType:                   0x24
bDescriptorSubtype:                0x07
bFrameIndex:                       0x0C
bmCapabilities:                    0x00
wWidth:                          0x0350 = 848
wHeight:                         0x01E0 = 480
dwMinBitRate:                0x01F0E000
dwMaxBitRate:                0x0BA54000
dwMaxVideoFrameBufferSize:   0x000C6C00
dwDefaultFrameInterval:      0x00051615 = 33.333300 mSec (30.00 Hz)
bFrameIntervalType:                0x07
===>Additional Discrete Frame TypeData
dwFrameInterval[1]:          0x00051615 = 33.333300 mSec (30.00 Hz)
dwFrameInterval[2]:          0x00065B9A = 41.666600 mSec (24.00 Hz)
dwFrameInterval[3]:          0x0007A120 = 50.000000 mSec (20.00 Hz)
dwFrameInterval[4]:          0x000A2C2A = 66.666600 mSec (15.00 Hz)
dwFrameInterval[5]:          0x000F4240 = 100.000000 mSec (10.00 Hz)
dwFrameInterval[6]:          0x00145855 = 133.333300 mSec (7.50 Hz)
dwFrameInterval[7]:          0x001E8480 = 200.000000 mSec (5.00 Hz)

          ===>Video Streaming MJPEG Frame Type Descriptor<===
bLength:                           0x36
bDescriptorType:                   0x24
bDescriptorSubtype:                0x07
bFrameIndex:                       0x0D
bmCapabilities:                    0x00
wWidth:                          0x03C0 = 960
wHeight:                         0x021C = 540
dwMinBitRate:                0x0278D000
dwMaxBitRate:                0x0ED4E000
dwMaxVideoFrameBufferSize:   0x000FD200
dwDefaultFrameInterval:      0x00051615 = 33.333300 mSec (30.00 Hz)
bFrameIntervalType:                0x07
===>Additional Discrete Frame TypeData
dwFrameInterval[1]:          0x00051615 = 33.333300 mSec (30.00 Hz)
dwFrameInterval[2]:          0x00065B9A = 41.666600 mSec (24.00 Hz)
dwFrameInterval[3]:          0x0007A120 = 50.000000 mSec (20.00 Hz)
dwFrameInterval[4]:          0x000A2C2A = 66.666600 mSec (15.00 Hz)
dwFrameInterval[5]:          0x000F4240 = 100.000000 mSec (10.00 Hz)
dwFrameInterval[6]:          0x00145855 = 133.333300 mSec (7.50 Hz)
dwFrameInterval[7]:          0x001E8480 = 200.000000 mSec (5.00 Hz)

          ===>Video Streaming MJPEG Frame Type Descriptor<===
bLength:                           0x36
bDescriptorType:                   0x24
bDescriptorSubtype:                0x07
bFrameIndex:                       0x0E
bmCapabilities:                    0x00
wWidth:                          0x0400 = 1024
wHeight:                         0x0240 = 576
dwMinBitRate:                0x02D00000
dwMaxBitRate:                0x10E00000
dwMaxVideoFrameBufferSize:   0x00120000
dwDefaultFrameInterval:      0x00051615 = 33.333300 mSec (30.00 Hz)
bFrameIntervalType:                0x07
===>Additional Discrete Frame TypeData
dwFrameInterval[1]:          0x00051615 = 33.333300 mSec (30.00 Hz)
dwFrameInterval[2]:          0x00065B9A = 41.666600 mSec (24.00 Hz)
dwFrameInterval[3]:          0x0007A120 = 50.000000 mSec (20.00 Hz)
dwFrameInterval[4]:          0x000A2C2A = 66.666600 mSec (15.00 Hz)
dwFrameInterval[5]:          0x000F4240 = 100.000000 mSec (10.00 Hz)
dwFrameInterval[6]:          0x00145855 = 133.333300 mSec (7.50 Hz)
dwFrameInterval[7]:          0x001E8480 = 200.000000 mSec (5.00 Hz)

          ===>Video Streaming MJPEG Frame Type Descriptor<===
bLength:                           0x36
bDescriptorType:                   0x24
bDescriptorSubtype:                0x07
bFrameIndex:                       0x0F
bmCapabilities:                    0x00
wWidth:                          0x0500 = 1280
wHeight:                         0x02D0 = 720
dwMinBitRate:                0x04650000
dwMaxBitRate:                0x1A5E0000
dwMaxVideoFrameBufferSize:   0x001C2000
dwDefaultFrameInterval:      0x00051615 = 33.333300 mSec (30.00 Hz)
bFrameIntervalType:                0x07
===>Additional Discrete Frame TypeData
dwFrameInterval[1]:          0x00051615 = 33.333300 mSec (30.00 Hz)
dwFrameInterval[2]:          0x00065B9A = 41.666600 mSec (24.00 Hz)
dwFrameInterval[3]:          0x0007A120 = 50.000000 mSec (20.00 Hz)
dwFrameInterval[4]:          0x000A2C2A = 66.666600 mSec (15.00 Hz)
dwFrameInterval[5]:          0x000F4240 = 100.000000 mSec (10.00 Hz)
dwFrameInterval[6]:          0x00145855 = 133.333300 mSec (7.50 Hz)
dwFrameInterval[7]:          0x001E8480 = 200.000000 mSec (5.00 Hz)

          ===>Video Streaming MJPEG Frame Type Descriptor<===
bLength:                           0x36
bDescriptorType:                   0x24
bDescriptorSubtype:                0x07
bFrameIndex:                       0x10
bmCapabilities:                    0x00
wWidth:                          0x0640 = 1600
wHeight:                         0x0380 = 896
dwMinBitRate:                0x06D60000
dwMaxBitRate:                0x29040000
dwMaxVideoFrameBufferSize:   0x002BC000
dwDefaultFrameInterval:      0x00051615 = 33.333300 mSec (30.00 Hz)
bFrameIntervalType:                0x07
===>Additional Discrete Frame TypeData
dwFrameInterval[1]:          0x00051615 = 33.333300 mSec (30.00 Hz)
dwFrameInterval[2]:          0x00065B9A = 41.666600 mSec (24.00 Hz)
dwFrameInterval[3]:          0x0007A120 = 50.000000 mSec (20.00 Hz)
dwFrameInterval[4]:          0x000A2C2A = 66.666600 mSec (15.00 Hz)
dwFrameInterval[5]:          0x000F4240 = 100.000000 mSec (10.00 Hz)
dwFrameInterval[6]:          0x00145855 = 133.333300 mSec (7.50 Hz)
dwFrameInterval[7]:          0x001E8480 = 200.000000 mSec (5.00 Hz)

          ===>Video Streaming MJPEG Frame Type Descriptor<===
bLength:                           0x36
bDescriptorType:                   0x24
bDescriptorSubtype:                0x07
bFrameIndex:                       0x11
bmCapabilities:                    0x00
wWidth:                          0x0780 = 1920
wHeight:                         0x0438 = 1080
dwMinBitRate:                0x09E34000
dwMaxBitRate:                0x3B538000
dwMaxVideoFrameBufferSize:   0x003F4800
dwDefaultFrameInterval:      0x00051615 = 33.333300 mSec (30.00 Hz)
bFrameIntervalType:                0x07
===>Additional Discrete Frame TypeData
dwFrameInterval[1]:          0x00051615 = 33.333300 mSec (30.00 Hz)
dwFrameInterval[2]:          0x00065B9A = 41.666600 mSec (24.00 Hz)
dwFrameInterval[3]:          0x0007A120 = 50.000000 mSec (20.00 Hz)
dwFrameInterval[4]:          0x000A2C2A = 66.666600 mSec (15.00 Hz)
dwFrameInterval[5]:          0x000F4240 = 100.000000 mSec (10.00 Hz)
dwFrameInterval[6]:          0x00145855 = 133.333300 mSec (7.50 Hz)
dwFrameInterval[7]:          0x001E8480 = 200.000000 mSec (5.00 Hz)

          ===>Color Matching Descriptor<===
bLength:                           0x06
bDescriptorType:                   0x24
bDescriptorSubtype:                0x0D
bColorPrimaries:                   0x01
bTransferCharacteristics:          0x01
bMatrixCoefficients:               0x04

          ===>Interface Descriptor<===
bLength:                           0x09
bDescriptorType:                   0x04
bInterfaceNumber:                  0x01
bAlternateSetting:                 0x01
bNumEndpoints:                     0x01
bInterfaceClass:                   0x0E  -> Video Interface Class
bInterfaceSubClass:                0x02  -> Video Streaming Interface SubClass
bInterfaceProtocol:                0x00
iInterface:                        0x00

          ===>Endpoint Descriptor<===
bLength:                           0x07
bDescriptorType:                   0x05
bEndpointAddress:                  0x81  -> Direction: IN - EndpointID: 1
bmAttributes:                      0x05  -> Isochronous Transfer Type, Synchronization Type = Asynchronous, Usage Type = Data Endpoint
wMaxPacketSize:                  0x00C0 = 1 transactions per microframe, 0xC0 max bytes
bInterval:                         0x01

          ===>Interface Descriptor<===
bLength:                           0x09
bDescriptorType:                   0x04
bInterfaceNumber:                  0x01
bAlternateSetting:                 0x02
bNumEndpoints:                     0x01
bInterfaceClass:                   0x0E  -> Video Interface Class
bInterfaceSubClass:                0x02  -> Video Streaming Interface SubClass
bInterfaceProtocol:                0x00
iInterface:                        0x00

          ===>Endpoint Descriptor<===
bLength:                           0x07
bDescriptorType:                   0x05
bEndpointAddress:                  0x81  -> Direction: IN - EndpointID: 1
bmAttributes:                      0x05  -> Isochronous Transfer Type, Synchronization Type = Asynchronous, Usage Type = Data Endpoint
wMaxPacketSize:                  0x0180 = 1 transactions per microframe, 0x180 max bytes
bInterval:                         0x01

          ===>Interface Descriptor<===
bLength:                           0x09
bDescriptorType:                   0x04
bInterfaceNumber:                  0x01
bAlternateSetting:                 0x03
bNumEndpoints:                     0x01
bInterfaceClass:                   0x0E  -> Video Interface Class
bInterfaceSubClass:                0x02  -> Video Streaming Interface SubClass
bInterfaceProtocol:                0x00
iInterface:                        0x00

          ===>Endpoint Descriptor<===
bLength:                           0x07
bDescriptorType:                   0x05
bEndpointAddress:                  0x81  -> Direction: IN - EndpointID: 1
bmAttributes:                      0x05  -> Isochronous Transfer Type, Synchronization Type = Asynchronous, Usage Type = Data Endpoint
wMaxPacketSize:                  0x0200 = 1 transactions per microframe, 0x200 max bytes
bInterval:                         0x01

          ===>Interface Descriptor<===
bLength:                           0x09
bDescriptorType:                   0x04
bInterfaceNumber:                  0x01
bAlternateSetting:                 0x04
bNumEndpoints:                     0x01
bInterfaceClass:                   0x0E  -> Video Interface Class
bInterfaceSubClass:                0x02  -> Video Streaming Interface SubClass
bInterfaceProtocol:                0x00
iInterface:                        0x00

          ===>Endpoint Descriptor<===
bLength:                           0x07
bDescriptorType:                   0x05
bEndpointAddress:                  0x81  -> Direction: IN - EndpointID: 1
bmAttributes:                      0x05  -> Isochronous Transfer Type, Synchronization Type = Asynchronous, Usage Type = Data Endpoint
wMaxPacketSize:                  0x0280 = 1 transactions per microframe, 0x280 max bytes
bInterval:                         0x01

          ===>Interface Descriptor<===
bLength:                           0x09
bDescriptorType:                   0x04
bInterfaceNumber:                  0x01
bAlternateSetting:                 0x05
bNumEndpoints:                     0x01
bInterfaceClass:                   0x0E  -> Video Interface Class
bInterfaceSubClass:                0x02  -> Video Streaming Interface SubClass
bInterfaceProtocol:                0x00
iInterface:                        0x00

          ===>Endpoint Descriptor<===
bLength:                           0x07
bDescriptorType:                   0x05
bEndpointAddress:                  0x81  -> Direction: IN - EndpointID: 1
bmAttributes:                      0x05  -> Isochronous Transfer Type, Synchronization Type = Asynchronous, Usage Type = Data Endpoint
wMaxPacketSize:                  0x0320 = 1 transactions per microframe, 0x320 max bytes
bInterval:                         0x01

          ===>Interface Descriptor<===
bLength:                           0x09
bDescriptorType:                   0x04
bInterfaceNumber:                  0x01
bAlternateSetting:                 0x06
bNumEndpoints:                     0x01
bInterfaceClass:                   0x0E  -> Video Interface Class
bInterfaceSubClass:                0x02  -> Video Streaming Interface SubClass
bInterfaceProtocol:                0x00
iInterface:                        0x00

          ===>Endpoint Descriptor<===
bLength:                           0x07
bDescriptorType:                   0x05
bEndpointAddress:                  0x81  -> Direction: IN - EndpointID: 1
bmAttributes:                      0x05  -> Isochronous Transfer Type, Synchronization Type = Asynchronous, Usage Type = Data Endpoint
wMaxPacketSize:                  0x03B0 = 1 transactions per microframe, 0x3B0 max bytes
bInterval:                         0x01

          ===>Interface Descriptor<===
bLength:                           0x09
bDescriptorType:                   0x04
bInterfaceNumber:                  0x01
bAlternateSetting:                 0x07
bNumEndpoints:                     0x01
bInterfaceClass:                   0x0E  -> Video Interface Class
bInterfaceSubClass:                0x02  -> Video Streaming Interface SubClass
bInterfaceProtocol:                0x00
iInterface:                        0x00

          ===>Endpoint Descriptor<===
bLength:                           0x07
bDescriptorType:                   0x05
bEndpointAddress:                  0x81  -> Direction: IN - EndpointID: 1
bmAttributes:                      0x05  -> Isochronous Transfer Type, Synchronization Type = Asynchronous, Usage Type = Data Endpoint
wMaxPacketSize:                  0x0A80 = 2 transactions per microframe, 0x280 max bytes
bInterval:                         0x01

          ===>Interface Descriptor<===
bLength:                           0x09
bDescriptorType:                   0x04
bInterfaceNumber:                  0x01
bAlternateSetting:                 0x08
bNumEndpoints:                     0x01
bInterfaceClass:                   0x0E  -> Video Interface Class
bInterfaceSubClass:                0x02  -> Video Streaming Interface SubClass
bInterfaceProtocol:                0x00
iInterface:                        0x00

          ===>Endpoint Descriptor<===
bLength:                           0x07
bDescriptorType:                   0x05
bEndpointAddress:                  0x81  -> Direction: IN - EndpointID: 1
bmAttributes:                      0x05  -> Isochronous Transfer Type, Synchronization Type = Asynchronous, Usage Type = Data Endpoint
wMaxPacketSize:                  0x0B20 = 2 transactions per microframe, 0x320 max bytes
bInterval:                         0x01

          ===>Interface Descriptor<===
bLength:                           0x09
bDescriptorType:                   0x04
bInterfaceNumber:                  0x01
bAlternateSetting:                 0x09
bNumEndpoints:                     0x01
bInterfaceClass:                   0x0E  -> Video Interface Class
bInterfaceSubClass:                0x02  -> Video Streaming Interface SubClass
bInterfaceProtocol:                0x00
iInterface:                        0x00

          ===>Endpoint Descriptor<===
bLength:                           0x07
bDescriptorType:                   0x05
bEndpointAddress:                  0x81  -> Direction: IN - EndpointID: 1
bmAttributes:                      0x05  -> Isochronous Transfer Type, Synchronization Type = Asynchronous, Usage Type = Data Endpoint
wMaxPacketSize:                  0x0BE0 = 2 transactions per microframe, 0x3E0 max bytes
bInterval:                         0x01

          ===>Interface Descriptor<===
bLength:                           0x09
bDescriptorType:                   0x04
bInterfaceNumber:                  0x01
bAlternateSetting:                 0x0A
bNumEndpoints:                     0x01
bInterfaceClass:                   0x0E  -> Video Interface Class
bInterfaceSubClass:                0x02  -> Video Streaming Interface SubClass
bInterfaceProtocol:                0x00
iInterface:                        0x00

          ===>Endpoint Descriptor<===
bLength:                           0x07
bDescriptorType:                   0x05
bEndpointAddress:                  0x81  -> Direction: IN - EndpointID: 1
bmAttributes:                      0x05  -> Isochronous Transfer Type, Synchronization Type = Asynchronous, Usage Type = Data Endpoint
wMaxPacketSize:                  0x1380 = 3 transactions per microframe, 0x380 max bytes
bInterval:                         0x01

          ===>Interface Descriptor<===
bLength:                           0x09
bDescriptorType:                   0x04
bInterfaceNumber:                  0x01
bAlternateSetting:                 0x0B
bNumEndpoints:                     0x01
bInterfaceClass:                   0x0E  -> Video Interface Class
bInterfaceSubClass:                0x02  -> Video Streaming Interface SubClass
bInterfaceProtocol:                0x00
iInterface:                        0x00

          ===>Endpoint Descriptor<===
bLength:                           0x07
bDescriptorType:                   0x05
bEndpointAddress:                  0x81  -> Direction: IN - EndpointID: 1
bmAttributes:                      0x05  -> Isochronous Transfer Type, Synchronization Type = Asynchronous, Usage Type = Data Endpoint
wMaxPacketSize:                  0x1400 = 3 transactions per microframe, 0x400 max bytes
bInterval:                         0x01

          ===>IAD Descriptor<===
bLength:                           0x08
bDescriptorType:                   0x0B
bFirstInterface:                   0x02
bInterfaceCount:                   0x02
bFunctionClass:                    0x01  -> Audio Interface Class
bFunctionSubClass:                 0x02  -> Audio Streaming Interface SubClass
bFunctionProtocol:                 0x00
iFunction:                         0x00

          ===>Interface Descriptor<===
bLength:                           0x09
bDescriptorType:                   0x04
bInterfaceNumber:                  0x02
bAlternateSetting:                 0x00
bNumEndpoints:                     0x00
bInterfaceClass:                   0x01  -> Audio Interface Class
bInterfaceSubClass:                0x01  -> Audio Control Interface SubClass
bInterfaceProtocol:                0x00
iInterface:                        0x00

          ===>Audio Control Interface Header Descriptor<===
bLength:                           0x09
bDescriptorType:                   0x24
bDescriptorSubtype:                0x01
bcdADC:                          0x0100
wTotalLength:                    0x0026
bInCollection:                     0x01
baInterfaceNr[1]:                  0x03

          ===>Audio Control Input Terminal Descriptor<===
bLength:                           0x0C
bDescriptorType:                   0x24
bDescriptorSubtype:                0x02
bTerminalID:                       0x01
wTerminalType:                   0x0201 (Microphone)
bAssocTerminal:                    0x00
bNrChannels:                       0x01
wChannelConfig:                  0x0003
iChannelNames:                     0x00
iTerminal:                         0x00

          ===>Audio Control Output Terminal Descriptor<===
bLength:                           0x09
bDescriptorType:                   0x24
bDescriptorSubtype:                0x03
bTerminalID:                       0x03
wTerminalType:                   0x0101 (USB streaming)
bAssocTerminal:                    0x00
bSourceID:                         0x05
iTerminal:                         0x00

          ===>Audio Control Feature Unit Descriptor<===
bLength:                           0x08
bDescriptorType:                   0x24
bDescriptorSubtype:                0x06
bUnitID:                           0x05
bSourceID:                         0x01
bControlSize:                      0x01
bmaControls[0]:                    03 
iFeature:                          0x00

          ===>Interface Descriptor<===
bLength:                           0x09
bDescriptorType:                   0x04
bInterfaceNumber:                  0x03
bAlternateSetting:                 0x00
bNumEndpoints:                     0x00
bInterfaceClass:                   0x01  -> Audio Interface Class
bInterfaceSubClass:                0x02  -> Audio Streaming Interface SubClass
bInterfaceProtocol:                0x00
iInterface:                        0x00

          ===>Interface Descriptor<===
bLength:                           0x09
bDescriptorType:                   0x04
bInterfaceNumber:                  0x03
bAlternateSetting:                 0x01
bNumEndpoints:                     0x01
bInterfaceClass:                   0x01  -> Audio Interface Class
bInterfaceSubClass:                0x02  -> Audio Streaming Interface SubClass
bInterfaceProtocol:                0x00
iInterface:                        0x00

          ===>Audio Streaming Class Specific Interface Descriptor<===
bLength:                           0x07
bDescriptorType:                   0x24
bDescriptorSubtype:                0x01
bTerminalLink:                     0x03
bDelay:                            0x01
wFormatTag:                      0x0001 (PCM)

          ===>Audio Streaming Format Type Descriptor<===
bLength:                           0x0B
bDescriptorType:                   0x24
bDescriptorSubtype:                0x02
bFormatType:                       0x01
bNrChannels:                       0x02
bSubframeSize:                     0x02
bBitResolution:                    0x10
bSamFreqType:                      0x01
tSamFreq[1]:                   0x003E80 (16000 Hz)

          ===>Endpoint Descriptor<===
bLength:                           0x09
bDescriptorType:                   0x05
bEndpointAddress:                  0x83  -> Direction: IN - EndpointID: 3
bmAttributes:                      0x05  -> Isochronous Transfer Type, Synchronization Type = Asynchronous, Usage Type = Data Endpoint
wMaxPacketSize:                  0x0044 = 1 transactions per microframe, 0x44 max bytes
wInterval:                       0x0004
bSyncAddress:                      0x00

          ===>Audio Streaming Class Specific Audio Data Endpoint Descriptor<===
bLength:                           0x07
bDescriptorType:                   0x25
bDescriptorSubtype:                0x01
bmAttributes:                      0x01
bLockDelayUnits:                   0x00
wLockDelay:                      0x0000

          ===>Interface Descriptor<===
bLength:                           0x09
bDescriptorType:                   0x04
bInterfaceNumber:                  0x03
bAlternateSetting:                 0x02
bNumEndpoints:                     0x01
bInterfaceClass:                   0x01  -> Audio Interface Class
bInterfaceSubClass:                0x02  -> Audio Streaming Interface SubClass
bInterfaceProtocol:                0x00
iInterface:                        0x00

          ===>Audio Streaming Class Specific Interface Descriptor<===
bLength:                           0x07
bDescriptorType:                   0x24
bDescriptorSubtype:                0x01
bTerminalLink:                     0x03
bDelay:                            0x01
wFormatTag:                      0x0001 (PCM)

          ===>Audio Streaming Format Type Descriptor<===
bLength:                           0x0B
bDescriptorType:                   0x24
bDescriptorSubtype:                0x02
bFormatType:                       0x01
bNrChannels:                       0x02
bSubframeSize:                     0x02
bBitResolution:                    0x10
bSamFreqType:                      0x01
tSamFreq[1]:                   0x005DC0 (24000 Hz)

          ===>Endpoint Descriptor<===
bLength:                           0x09
bDescriptorType:                   0x05
bEndpointAddress:                  0x83  -> Direction: IN - EndpointID: 3
bmAttributes:                      0x05  -> Isochronous Transfer Type, Synchronization Type = Asynchronous, Usage Type = Data Endpoint
wMaxPacketSize:                  0x0064 = 1 transactions per microframe, 0x64 max bytes
wInterval:                       0x0004
bSyncAddress:                      0x00

          ===>Audio Streaming Class Specific Audio Data Endpoint Descriptor<===
bLength:                           0x07
bDescriptorType:                   0x25
bDescriptorSubtype:                0x01
bmAttributes:                      0x01
bLockDelayUnits:                   0x00
wLockDelay:                      0x0000

          ===>Interface Descriptor<===
bLength:                           0x09
bDescriptorType:                   0x04
bInterfaceNumber:                  0x03
bAlternateSetting:                 0x03
bNumEndpoints:                     0x01
bInterfaceClass:                   0x01  -> Audio Interface Class
bInterfaceSubClass:                0x02  -> Audio Streaming Interface SubClass
bInterfaceProtocol:                0x00
iInterface:                        0x00

          ===>Audio Streaming Class Specific Interface Descriptor<===
bLength:                           0x07
bDescriptorType:                   0x24
bDescriptorSubtype:                0x01
bTerminalLink:                     0x03
bDelay:                            0x01
wFormatTag:                      0x0001 (PCM)

          ===>Audio Streaming Format Type Descriptor<===
bLength:                           0x0B
bDescriptorType:                   0x24
bDescriptorSubtype:                0x02
bFormatType:                       0x01
bNrChannels:                       0x02
bSubframeSize:                     0x02
bBitResolution:                    0x10
bSamFreqType:                      0x01
tSamFreq[1]:                   0x007D00 (32000 Hz)

          ===>Endpoint Descriptor<===
bLength:                           0x09
bDescriptorType:                   0x05
bEndpointAddress:                  0x83  -> Direction: IN - EndpointID: 3
bmAttributes:                      0x05  -> Isochronous Transfer Type, Synchronization Type = Asynchronous, Usage Type = Data Endpoint
wMaxPacketSize:                  0x0084 = 1 transactions per microframe, 0x84 max bytes
wInterval:                       0x0004
bSyncAddress:                      0x00

          ===>Audio Streaming Class Specific Audio Data Endpoint Descriptor<===
bLength:                           0x07
bDescriptorType:                   0x25
bDescriptorSubtype:                0x01
bmAttributes:                      0x01
bLockDelayUnits:                   0x00
wLockDelay:                      0x0000

          ===>Interface Descriptor<===
bLength:                           0x09
bDescriptorType:                   0x04
bInterfaceNumber:                  0x03
bAlternateSetting:                 0x04
bNumEndpoints:                     0x01
bInterfaceClass:                   0x01  -> Audio Interface Class
bInterfaceSubClass:                0x02  -> Audio Streaming Interface SubClass
bInterfaceProtocol:                0x00
iInterface:                        0x00

          ===>Audio Streaming Class Specific Interface Descriptor<===
bLength:                           0x07
bDescriptorType:                   0x24
bDescriptorSubtype:                0x01
bTerminalLink:                     0x03
bDelay:                            0x01
wFormatTag:                      0x0001 (PCM)

          ===>Audio Streaming Format Type Descriptor<===
bLength:                           0x0B
bDescriptorType:                   0x24
bDescriptorSubtype:                0x02
bFormatType:                       0x01
bNrChannels:                       0x02
bSubframeSize:                     0x02
bBitResolution:                    0x10
bSamFreqType:                      0x01
tSamFreq[1]:                   0x00BB80 (48000 Hz)

          ===>Endpoint Descriptor<===
bLength:                           0x09
bDescriptorType:                   0x05
bEndpointAddress:                  0x83  -> Direction: IN - EndpointID: 3
bmAttributes:                      0x05  -> Isochronous Transfer Type, Synchronization Type = Asynchronous, Usage Type = Data Endpoint
wMaxPacketSize:                  0x00C4 = 1 transactions per microframe, 0xC4 max bytes
wInterval:                       0x0004
bSyncAddress:                      0x00

          ===>Audio Streaming Class Specific Audio Data Endpoint Descriptor<===
bLength:                           0x07
bDescriptorType:                   0x25
bDescriptorSubtype:                0x01
bmAttributes:                      0x01
bLockDelayUnits:                   0x00
wLockDelay:                      0x0000

          ===>Additional Error Checking<===
PASS: number of uncompressed-frame frame descriptors (19) == number of frame descriptors (19) specified in uncompressed format descriptor(s)
PASS: number of MJPEG frame descriptors (17) == number of frame descriptors (17) specified in MJPEG format descriptor(s)
[Port11] 


Is Port User Connectable:         no
Is Port Debug Capable:            no
Companion Port Number:            0
Companion Hub Symbolic Link Name: 
Protocols Supported:
 USB 1.1:                         yes
 USB 2.0:                         yes
 USB 3.0:                         no

ConnectionStatus:      NoDeviceConnected
[Port12] 


Is Port User Connectable:         no
Is Port Debug Capable:            no
Companion Port Number:            0
Companion Hub Symbolic Link Name: 
Protocols Supported:
 USB 1.1:                         yes
 USB 2.0:                         yes
 USB 3.0:                         no

ConnectionStatus:      NoDeviceConnected
[Port13] 


Is Port User Connectable:         no
Is Port Debug Capable:            no
Companion Port Number:            0
Companion Hub Symbolic Link Name: 
Protocols Supported:
 USB 1.1:                         yes
 USB 2.0:                         yes
 USB 3.0:                         no

ConnectionStatus:      NoDeviceConnected
[Port14] 


Is Port User Connectable:         no
Is Port Debug Capable:            no
Companion Port Number:            0
Companion Hub Symbolic Link Name: 
Protocols Supported:
 USB 1.1:                         yes
 USB 2.0:                         yes
 USB 3.0:                         no

ConnectionStatus:      NoDeviceConnected
[Port15] 


Is Port User Connectable:         no
Is Port Debug Capable:            no
Companion Port Number:            0
Companion Hub Symbolic Link Name: 
Protocols Supported:
 USB 1.1:                         yes
 USB 2.0:                         yes
 USB 3.0:                         no

ConnectionStatus:      NoDeviceConnected
[Port16] 


Is Port User Connectable:         no
Is Port Debug Capable:            no
Companion Port Number:            0
Companion Hub Symbolic Link Name: 
Protocols Supported:
 USB 1.1:                         yes
 USB 2.0:                         yes
 USB 3.0:                         no

ConnectionStatus:      NoDeviceConnected
[Port17] 


Is Port User Connectable:         yes
Is Port Debug Capable:            yes
Companion Port Number:            1
Companion Hub Symbolic Link Name: USB#ROOT_HUB30#4&3b5bb164&0&0#{f18a0e88-c30c-11d0-8815-00a0c906bed8}
Protocols Supported:
 USB 1.1:                         no
 USB 2.0:                         no
 USB 3.0:                         yes

ConnectionStatus:      NoDeviceConnected
[Port18] 


Is Port User Connectable:         yes
Is Port Debug Capable:            yes
Companion Port Number:            2
Companion Hub Symbolic Link Name: USB#ROOT_HUB30#4&3b5bb164&0&0#{f18a0e88-c30c-11d0-8815-00a0c906bed8}
Protocols Supported:
 USB 1.1:                         no
 USB 2.0:                         no
 USB 3.0:                         yes

ConnectionStatus:      NoDeviceConnected
[Port19] 


Is Port User Connectable:         yes
Is Port Debug Capable:            yes
Companion Port Number:            4
Companion Hub Symbolic Link Name: USB#ROOT_HUB30#4&3b5bb164&0&0#{f18a0e88-c30c-11d0-8815-00a0c906bed8}
Protocols Supported:
 USB 1.1:                         no
 USB 2.0:                         no
 USB 3.0:                         yes

ConnectionStatus:      NoDeviceConnected
[Port20] 


Is Port User Connectable:         yes
Is Port Debug Capable:            yes
Companion Port Number:            5
Companion Hub Symbolic Link Name: USB#ROOT_HUB30#4&3b5bb164&0&0#{f18a0e88-c30c-11d0-8815-00a0c906bed8}
Protocols Supported:
 USB 1.1:                         no
 USB 2.0:                         no
 USB 3.0:                         yes

ConnectionStatus:      NoDeviceConnected
[Port21] 


Is Port User Connectable:         yes
Is Port Debug Capable:            yes
Companion Port Number:            7
Companion Hub Symbolic Link Name: USB#ROOT_HUB30#4&3b5bb164&0&0#{f18a0e88-c30c-11d0-8815-00a0c906bed8}
Protocols Supported:
 USB 1.1:                         no
 USB 2.0:                         no
 USB 3.0:                         yes

ConnectionStatus:      NoDeviceConnected
[Port22] 


Is Port User Connectable:         yes
Is Port Debug Capable:            yes
Companion Port Number:            3
Companion Hub Symbolic Link Name: USB#ROOT_HUB30#4&3b5bb164&0&0#{f18a0e88-c30c-11d0-8815-00a0c906bed8}
Protocols Supported:
 USB 1.1:                         no
 USB 2.0:                         no
 USB 3.0:                         yes

ConnectionStatus:      NoDeviceConnected
[Port23] 


Is Port User Connectable:         no
Is Port Debug Capable:            yes
Companion Port Number:            0
Companion Hub Symbolic Link Name: 
Protocols Supported:
 USB 1.1:                         no
 USB 2.0:                         no
 USB 3.0:                         yes

ConnectionStatus:      NoDeviceConnected
[Port24] 


Is Port User Connectable:         no
Is Port Debug Capable:            yes
Companion Port Number:            0
Companion Hub Symbolic Link Name: 
Protocols Supported:
 USB 1.1:                         no
 USB 2.0:                         no
 USB 3.0:                         yes

ConnectionStatus:      NoDeviceConnected
[Port25] 


Is Port User Connectable:         no
Is Port Debug Capable:            yes
Companion Port Number:            0
Companion Hub Symbolic Link Name: 
Protocols Supported:
 USB 1.1:                         no
 USB 2.0:                         no
 USB 3.0:                         yes

ConnectionStatus:      NoDeviceConnected
[Port26] 


Is Port User Connectable:         no
Is Port Debug Capable:            yes
Companion Port Number:            0
Companion Hub Symbolic Link Name: 
Protocols Supported:
 USB 1.1:                         no
 USB 2.0:                         no
 USB 3.0:                         yes

ConnectionStatus:      NoDeviceConnected
